CONVERSATION ID,CONVERSATION TITLE,FROM,SENDER PROFILE URL,TO,RECIPIENT PROFILE URLS,DATE,SUBJECT,CONTENT,FOLDER
2-MjMzODI4ODAtOGM3MS00NDY4LTk4M2MtN2JjNGIwY2YwOTg3XzEwMA==,Sponsored Conversation,LinkedIn Member,,Davide Consiglio,https://www.linkedin.com/in/davideconsiglio,2025-04-19 02:18:29 UTC,,"<p class=""spinmail-quill-editor__spin-break"">Hi there, %FIRSTNAME%!</p><p class=""spinmail-quill-editor__spin-break""><br></p><p class=""spinmail-quill-editor__spin-break"">Reactivate your Premium subscription now and get 50% off 2 months of LinkedIn Premium.</p>",INBOX
2-NDA0MDg3ZWUtYmVmMi00ZWE1LTk4MGMtMjRiNDY3NWZlY2ZkXzEwMA==,Reimagine Your Career with a 100% Online DBA,Prof. Dr. David Costa,,Davide Consiglio,https://www.linkedin.com/in/davideconsiglio,2025-04-16 02:18:27 UTC,,"<p class=""spinmail-quill-editor__spin-break"">Dear Davide,</p><p class=""spinmail-quill-editor__spin-break""><br></p><p class=""spinmail-quill-editor__spin-break"">I’m Prof. David Costa, Dean at Robert Kennedy College, Zürich, Switzerland.</p><p class=""spinmail-quill-editor__spin-break""><br></p><p class=""spinmail-quill-editor__spin-break"">After reviewing your profile, I believe that with your impressive background and Master’s degree, you are an excellent candidate for our 100% Online&nbsp;<strong>Doctor of Business Administration (DBA)</strong>&nbsp;programme, delivered in partnership with the prestigious University of Salford, UK.</p><p class=""spinmail-quill-editor__spin-break""><br></p><p class=""spinmail-quill-editor__spin-break"">This programme combines the renowned&nbsp;<strong>Swiss Quality Education</strong>&nbsp;with the&nbsp;<strong>British tradition of academic excellence</strong>, offering you the opportunity to conduct impactful research while balancing your professional and personal life.</p><p class=""spinmail-quill-editor__spin-break""><br></p><p class=""spinmail-quill-editor__spin-break""><strong>Why consider the Salford DBA?</strong></p><p class=""spinmail-quill-editor__spin-break"">🎓&nbsp;<strong>Two-Stage Pathway</strong>: Begin with the MSc in Management Research (in just 1 year), then progress to the DBA.</p><p class=""spinmail-quill-editor__spin-break"">🌍&nbsp;<strong>Globally Recognised Degree</strong>: A prestigious British doctorate to advance your career.</p><p class=""spinmail-quill-editor__spin-break"">🖥️&nbsp;<strong>100% Online Learning</strong>: Flexible study tailored to busy professionals.</p><p class=""spinmail-quill-editor__spin-break"">💡&nbsp;<strong>Practical Impact</strong>: Research real-world business challenges and develop actionable solutions.</p><p class=""spinmail-quill-editor__spin-break""><br></p><p class=""spinmail-quill-editor__spin-break"">I believe this could be the perfect next step for you. Would you like to explore this opportunity further?</p><p class=""spinmail-quill-editor__spin-break""><br></p><p class=""spinmail-quill-editor__spin-break"">Limited places available—get your&nbsp;<strong>DBA course catalogue</strong>&nbsp;and enjoy a&nbsp;<strong>free application evaluation</strong>&nbsp;today!</p><p class=""spinmail-quill-editor__spin-break""><br></p><p class=""spinmail-quill-editor__spin-break"">Warm regards,</p><p class=""spinmail-quill-editor__spin-break"">Prof. Dr. David Costa, Dean</p><p class=""spinmail-quill-editor__spin-break"">Robert Kennedy College AG 🇨🇭</p><p class=""spinmail-quill-editor__spin-break"">Zürich, Switzerland</p>",INBOX
2-ZmNkYzc4ODctZDVkZi01OGJhLTg2NTktOTY2YjRhYjFhN2ZkXzAxMg==,,Alessandro Colombo,https://www.linkedin.com/in/colomboa,Davide Consiglio,https://www.linkedin.com/in/davideconsiglio,2025-04-15 18:31:27 UTC,,W amazon,INBOX
2-ZmNkYzc4ODctZDVkZi01OGJhLTg2NTktOTY2YjRhYjFhN2ZkXzAxMg==,,Davide Consiglio,https://www.linkedin.com/in/davideconsiglio,Alessandro Colombo,https://www.linkedin.com/in/colomboa,2025-04-15 18:31:09 UTC,,Azz ,INBOX
2-ZmNkYzc4ODctZDVkZi01OGJhLTg2NTktOTY2YjRhYjFhN2ZkXzAxMg==,,Alessandro Colombo,https://www.linkedin.com/in/colomboa,Davide Consiglio,https://www.linkedin.com/in/davideconsiglio,2025-04-15 18:29:38 UTC,,,INBOX
2-ZmNkYzc4ODctZDVkZi01OGJhLTg2NTktOTY2YjRhYjFhN2ZkXzAxMg==,,Davide Consiglio,https://www.linkedin.com/in/davideconsiglio,Alessandro Colombo,https://www.linkedin.com/in/colomboa,2019-12-05 19:41:24 UTC,,Al momento no ma fagli mandare il CV a me e Pezzotta e inserire anche sul sito Generali.it  Grazie ciao ,INBOX
2-ZmNkYzc4ODctZDVkZi01OGJhLTg2NTktOTY2YjRhYjFhN2ZkXzAxMg==,,Alessandro Colombo,https://www.linkedin.com/in/colomboa,Davide Consiglio,https://www.linkedin.com/in/davideconsiglio,2019-12-05 18:21:30 UTC,,Stiamo cercando altri ABL? Nel caso qui c'è un candidato,INBOX
2-ZmNkYzc4ODctZDVkZi01OGJhLTg2NTktOTY2YjRhYjFhN2ZkXzAxMg==,,Alessandro Colombo,https://www.linkedin.com/in/colomboa,Davide Consiglio,https://www.linkedin.com/in/davideconsiglio,2019-01-13 11:19:31 UTC,,OK,INBOX
2-ZmNkYzc4ODctZDVkZi01OGJhLTg2NTktOTY2YjRhYjFhN2ZkXzAxMg==,,Davide Consiglio,https://www.linkedin.com/in/davideconsiglio,Alessandro Colombo,https://www.linkedin.com/in/colomboa,2019-01-13 10:21:06 UTC,,Gli ho chiesto amicizia vediamo,INBOX
2-ZmNkYzc4ODctZDVkZi01OGJhLTg2NTktOTY2YjRhYjFhN2ZkXzAxMg==,,Davide Consiglio,https://www.linkedin.com/in/davideconsiglio,Alessandro Colombo,https://www.linkedin.com/in/colomboa,2019-01-08 21:30:05 UTC,,Ok ricordami giovedì che lo chiamo,INBOX
2-ZmNkYzc4ODctZDVkZi01OGJhLTg2NTktOTY2YjRhYjFhN2ZkXzAxMg==,,Alessandro Colombo,https://www.linkedin.com/in/colomboa,Davide Consiglio,https://www.linkedin.com/in/davideconsiglio,2019-01-08 16:10:52 UTC,,Questa è per la computer vision,INBOX
2-ZmNkYzc4ODctZDVkZi01OGJhLTg2NTktOTY2YjRhYjFhN2ZkXzAxMg==,,Alessandro Colombo,https://www.linkedin.com/in/colomboa,Davide Consiglio,https://www.linkedin.com/in/davideconsiglio,2019-01-08 16:10:29 UTC,,https://www.linkedin.com/in/federicobaffetti,INBOX
2-MGMxOGJkYmEtZmQxZi00YjA1LWFhYTItODJhNDc5YmZmNWFiXzAxMw==,,Edoardo Legnani,https://www.linkedin.com/in/edoardo-legnani-376314187,Davide Consiglio,https://www.linkedin.com/in/davideconsiglio,2025-04-06 15:04:32 UTC,,Ahahahah eh dai vedi di trovare un accordo 😀,INBOX
2-MGMxOGJkYmEtZmQxZi00YjA1LWFhYTItODJhNDc5YmZmNWFiXzAxMw==,,Davide Consiglio,https://www.linkedin.com/in/davideconsiglio,Edoardo Legnani,https://www.linkedin.com/in/edoardo-legnani-376314187,2025-04-06 09:33:29 UTC,,Bene bene l’anno è andato molto bene ! Eh mi toccherà sentite Bonajuto gli do dritte … o troviamo un accordo ;-) ,INBOX
2-MGMxOGJkYmEtZmQxZi00YjA1LWFhYTItODJhNDc5YmZmNWFiXzAxMw==,,Davide Consiglio,https://www.linkedin.com/in/davideconsiglio,Edoardo Legnani,https://www.linkedin.com/in/edoardo-legnani-376314187,2025-04-06 09:32:28 UTC,,Ho visto grandissimo ,INBOX
2-MGMxOGJkYmEtZmQxZi00YjA1LWFhYTItODJhNDc5YmZmNWFiXzAxMw==,,Edoardo Legnani,https://www.linkedin.com/in/edoardo-legnani-376314187,Davide Consiglio,https://www.linkedin.com/in/davideconsiglio,2025-04-06 07:25:51 UTC,,Tu invece?,INBOX
2-MGMxOGJkYmEtZmQxZi00YjA1LWFhYTItODJhNDc5YmZmNWFiXzAxMw==,,Edoardo Legnani,https://www.linkedin.com/in/edoardo-legnani-376314187,Davide Consiglio,https://www.linkedin.com/in/davideconsiglio,2025-04-06 07:25:47 UTC,,Il data officer insomma… ci sta provando ma il casino che c’è sotto é grande,INBOX
2-ZWYzYjRlYjctMmNkZC01MGNjLTgwMjMtMmM0YmRlZjVlMDFmXzAwMA==,,Davide Consiglio,https://www.linkedin.com/in/davideconsiglio,Giacomo Chiavari,https://www.linkedin.com/in/giacomo-chiavari-931b7a,2025-04-05 11:55:38 UTC,,"Un caro saluto e a presto, Davide ",INBOX
2-ZWYzYjRlYjctMmNkZC01MGNjLTgwMjMtMmM0YmRlZjVlMDFmXzAwMA==,,Davide Consiglio,https://www.linkedin.com/in/davideconsiglio,Giacomo Chiavari,https://www.linkedin.com/in/giacomo-chiavari-931b7a,2025-04-05 11:55:29 UTC,,Se da voi può interessare il mio profilo stra volentieri vengo a trovarti un’ora - vi ho incrociato un paio di volte da cliente e secondo me il business case c’è ,INBOX
2-ZWYzYjRlYjctMmNkZC01MGNjLTgwMjMtMmM0YmRlZjVlMDFmXzAwMA==,,Davide Consiglio,https://www.linkedin.com/in/davideconsiglio,Giacomo Chiavari,https://www.linkedin.com/in/giacomo-chiavari-931b7a,2025-04-05 11:54:41 UTC,,Ti scrivo oltre che per salutarti anche perché dopo sette anni di grande azienda regolata diciamo che … non ne posso più - ahimè la tecnologia è sempre meno e la burocrazia troppa e mi sono deciso a guardarmi intorno con il criterio terra terra… alumni in società di Consulting ;-) ,INBOX
2-ZWYzYjRlYjctMmNkZC01MGNjLTgwMjMtMmM0YmRlZjVlMDFmXzAwMA==,,Davide Consiglio,https://www.linkedin.com/in/davideconsiglio,Giacomo Chiavari,https://www.linkedin.com/in/giacomo-chiavari-931b7a,2025-04-05 11:53:22 UTC,,Ciao Giacomo come stai? Spero tutto benone - è una vita che non ci sentiamo shame on me ,INBOX
2-ZWYzYjRlYjctMmNkZC01MGNjLTgwMjMtMmM0YmRlZjVlMDFmXzAwMA==,,Davide Consiglio,https://www.linkedin.com/in/davideconsiglio,Giacomo Chiavari,https://www.linkedin.com/in/giacomo-chiavari-931b7a,2018-09-14 05:27:23 UTC,,"Diciamo Davide contro Golia! :-) ok grazie lo stesso, a presto un abbraccio, D",INBOX
2-ZWYzYjRlYjctMmNkZC01MGNjLTgwMjMtMmM0YmRlZjVlMDFmXzAwMA==,,Giacomo Chiavari,https://www.linkedin.com/in/giacomo-chiavari-931b7a,Davide Consiglio,https://www.linkedin.com/in/davideconsiglio,2018-09-13 21:20:51 UTC,,"Ciao Davide, molto bene. Grande sbattimento, ma anche belle soddisfazioni. E tu ? Come va la tua sfida di ammodernamento del colosso ?  Lorenzo Baldini ? Sai che non mi ricordo di lui. Non so come sia finito nei miei contatti, ma il nome mi dice poco. Ciao, G",INBOX
2-ZWYzYjRlYjctMmNkZC01MGNjLTgwMjMtMmM0YmRlZjVlMDFmXzAwMA==,,Davide Consiglio,https://www.linkedin.com/in/davideconsiglio,Giacomo Chiavari,https://www.linkedin.com/in/giacomo-chiavari-931b7a,2018-09-13 14:18:58 UTC,,"Ciao Giacomo come stai come va dopo il primo anno nella post BCG era? :-)  Ho visto che hai nel network Lorenzo Baldini C in BCG, lo conosci? E' bravo?   Grazie! D",INBOX
2-ODVlNDNiMDQtZjgwNi01Mzg2LWJkZTMtZjI1YjVlODYwN2E2XzAwMA==,,Marco Santambrogio,https://www.linkedin.com/in/marcosantambrogio,Davide Consiglio,https://www.linkedin.com/in/davideconsiglio,2025-03-10 11:41:22 UTC,,,INBOX
2-ODVlNDNiMDQtZjgwNi01Mzg2LWJkZTMtZjI1YjVlODYwN2E2XzAwMA==,,Davide Consiglio,https://www.linkedin.com/in/davideconsiglio,Marco Santambrogio,https://www.linkedin.com/in/marcosantambrogio,2022-12-05 09:06:55 UTC,,Numero unooooooo,INBOX
2-ODVlNDNiMDQtZjgwNi01Mzg2LWJkZTMtZjI1YjVlODYwN2E2XzAwMA==,,Marco Santambrogio,https://www.linkedin.com/in/marcosantambrogio,Davide Consiglio,https://www.linkedin.com/in/davideconsiglio,2022-12-05 08:50:01 UTC,,Io sto imbarcando Vado a Cuba fino a domenica,INBOX
2-ODVlNDNiMDQtZjgwNi01Mzg2LWJkZTMtZjI1YjVlODYwN2E2XzAwMA==,,Marco Santambrogio,https://www.linkedin.com/in/marcosantambrogio,Davide Consiglio,https://www.linkedin.com/in/davideconsiglio,2022-12-05 08:49:37 UTC,,Mmm ci penso ma non è il mio ambito,INBOX
2-ODVlNDNiMDQtZjgwNi01Mzg2LWJkZTMtZjI1YjVlODYwN2E2XzAwMA==,,Davide Consiglio,https://www.linkedin.com/in/davideconsiglio,Marco Santambrogio,https://www.linkedin.com/in/marcosantambrogio,2022-12-05 08:14:02 UTC,,Che fai nel ponte? Io cervinia duro e puro.... :),INBOX
2-NmIwODRjZTMtNzYzMC00ZTBmLWE3NWMtZGIyZDEwODY1YzM5XzEwMA==,,Carlo Torniai,https://www.linkedin.com/in/carlotorniai,Davide Consiglio,https://www.linkedin.com/in/davideconsiglio,2025-02-12 09:38:47 UTC,,👍,INBOX
2-NmIwODRjZTMtNzYzMC00ZTBmLWE3NWMtZGIyZDEwODY1YzM5XzEwMA==,,Davide Consiglio,https://www.linkedin.com/in/davideconsiglio,Carlo Torniai,https://www.linkedin.com/in/carlotorniai,2025-02-12 09:38:45 UTC,,"Super grazie sì ci mancherebbe ti faccio mandare whatsapp, quando puoi ",INBOX
2-NmIwODRjZTMtNzYzMC00ZTBmLWE3NWMtZGIyZDEwODY1YzM5XzEwMA==,,Davide Consiglio,https://www.linkedin.com/in/davideconsiglio,Carlo Torniai,https://www.linkedin.com/in/carlotorniai,2025-02-12 09:38:06 UTC,,Io benone non mi lamento in attesa dei grandi eventi Corporate di aprile!!  Vediamo come va a finire 🤭,INBOX
2-NmIwODRjZTMtNzYzMC00ZTBmLWE3NWMtZGIyZDEwODY1YzM5XzEwMA==,,Carlo Torniai,https://www.linkedin.com/in/carlotorniai,Davide Consiglio,https://www.linkedin.com/in/davideconsiglio,2025-02-12 09:36:17 UTC,,Ciao Davide come stai ? Certo molto volentieri. Ci parlo volentieri anche se di Alpha Sigma non so molto. Ti lascio il mio cell: 3665836416. Non so se riuscirò questa settimana ma ci provo ,INBOX
2-NmIwODRjZTMtNzYzMC00ZTBmLWE3NWMtZGIyZDEwODY1YzM5XzEwMA==,,Davide Consiglio,https://www.linkedin.com/in/davideconsiglio,Carlo Torniai,https://www.linkedin.com/in/carlotorniai,2025-02-12 09:32:24 UTC,,"Ciao Carlo come stai? Spero tutto benone e che tu stia facendo cose spettacolari come sempre - ti scrivo per chiederti un favore: il mio miglior DE, Diego Paladini, ha ricevuto un'offerta economicamente molto valida da Alfa Sigma. Io non trattengo mai nessuno se è felice di andare, ma in questo caso il tipo di azienda mi preoccupa un po'. Mi sei venuto in mente dato che sei in Angelini: se avessi 10 minuti e gli puoi raccontare un po' questo settore sarebbe oro ... se puoi/vuoi e mi dai il tuo numero ti faccio scrivere direttamente - grazie mille e spero a presto, DC",INBOX
2-NzFlMzA5NTctNzg4NS00YTQzLWEwZGYtNmExYzAxYjZmNzhlXzAxMw==,,Marta Gambarini,https://www.linkedin.com/in/marta-gambarini-2603a114,Davide Consiglio,https://www.linkedin.com/in/davideconsiglio,2025-02-11 16:26:14 UTC,,"Ciao Davide, come stai? Non so se hai notato ma mi hanno licenziata da S&P. Tu sai se cercate Senior Relationship Managers? Ti ho allegato il mio CV.   Grazie per qualsiasi consiglio potrai darmi.  A presto, la Gamba :-)",INBOX
2-NDJiMjdlY2QtY2I0OS00MDRhLWJlMTAtNDRmZDA5YTA0ZDcwXzAxMw==,,Pietro Papoff,https://www.linkedin.com/in/pietropapoff,Davide Consiglio,https://www.linkedin.com/in/davideconsiglio,2025-02-07 19:32:29 UTC,,sono il direttore del consorzio ELIS. Mi presento. Con vivissima cordialità,INBOX
2-M2RhMTgwY2UtMzY3ZS00ZTRhLTkwYWUtNmNiZGIxMDMwNjllXzAxMw==,,Antonino Sapienza,https://www.linkedin.com/in/antonino-sapienza,Davide Consiglio,https://www.linkedin.com/in/davideconsiglio,2024-12-02 09:38:18 UTC,,"Buongiorno Davide,  ho visto che partecipa al mio evento LinkedIn - ""CreditSuite, l'innovativa piattaforma di gestione e recupero del credito"". Ne approfitto per darle il ""benvenuto"".  Un ""caffè virtuale"" per conoscere ""CreditSuite"", la nostra piattaforma di gestione e recupero del credito, considerata dal mercato la migliore soluzione digitale di settore.   Può fissare il suo caffè, senza alcun impegno ed a titolo informativo, scegliendo una data tra il 25 novembre ed il 6 dicembre e l'orario preferito dall'apposito calendario:  https://calendly.com/antonino-h9pt/un-caffe-con-antonino-creditsuite  Ci sarò io ad accoglierla! Grazie.   Cordiali saluti.  Antonino Sapienza DigitalSuite Italia Via Luigi Razza, 8, 20124 Milano - antonino@digitalsuite.eu - skype: ant.sapienza - mobile 342 8023594 La nostra Azienda: www.digitalsuite.eu",INBOX
2-M2RhMTgwY2UtMzY3ZS00ZTRhLTkwYWUtNmNiZGIxMDMwNjllXzAxMw==,,Antonino Sapienza,https://www.linkedin.com/in/antonino-sapienza,Davide Consiglio,https://www.linkedin.com/in/davideconsiglio,2024-11-25 16:44:22 UTC,,"Buonasera Davide,   le do il benvenuto al mio evento LinkedIn - ""CreditSuite, l'innovativa piattaforma di gestione e recupero del credito"".  Un caffè virtuale per conoscere ""CreditSuite"", l'innovativa piattaforma di gestione e recupero del credito, e tutte le ultimissime novità del 2024.  Può fissare il suo caffè virtuale scegliendo una data tra il 25 novembre ed il 6 dicembre e l'orario preferito dall'apposito calendario:  https://calendly.com/antonino-h9pt/un-caffe-con-antonino-creditsuite  Ci sarò io ad accoglierla!   Grazie.   Cordiali saluti.  Antonino Sapienza DigitalSuite Italia Via Luigi Razza, 8, 20124 Milano - antonino@digitalsuite.eu - skype: ant.sapienza - mobile 342 8023594 Il sito CreditSuite: www.creditsuite.eu La nostra Azienda: www.digitalsuite.eu",INBOX
2-M2RhMTgwY2UtMzY3ZS00ZTRhLTkwYWUtNmNiZGIxMDMwNjllXzAxMw==,,Antonino Sapienza,https://www.linkedin.com/in/antonino-sapienza,Davide Consiglio,https://www.linkedin.com/in/davideconsiglio,2024-06-20 12:16:52 UTC,,"Buonasera Davide,   la ringrazio per essersi iscritto al mio evento ""Un caffè con Antonino. Parliamo di AiMySuite, l'AI per la Customer Care"".  https://www.linkedin.com/events/uncaff-conantonino-parliamodiai7202330211562983424/  Qualora volesse fissare il ""caffè"" può prenotare dal calendario. https://calendly.com/antonino-h9pt/un-caffe-con-antonino  Sarò ben lieto di illustrarle questa innovativa suite.  Le allego il nostro flyer di presentazione. In attesa le auguro una proficua giornata.   Cordiali saluti.  Antonino Sapienza DigitalSuite Italia Via Luigi Razza, 8, 20124 Milano - mobile 342 8023594 La nostra Azienda: www.digitalsuite.eu",INBOX
2-M2RhMTgwY2UtMzY3ZS00ZTRhLTkwYWUtNmNiZGIxMDMwNjllXzAxMw==,,Antonino Sapienza,https://www.linkedin.com/in/antonino-sapienza,Davide Consiglio,https://www.linkedin.com/in/davideconsiglio,2024-02-20 15:15:59 UTC,,"Buonasera Davide,  la ringrazio per essersi iscritto al mio evento ""Il tempo di un caffè: ti racconto le nostre suite digitali per Imprese e PA"".  Qualora avesse necessità o curiosità di conoscere (anche a titolo informativo) le nostre suite non esiti a contattarmi al mio ufficio on line dal link: https://bit.ly/ufficio_antonino  oppure tramite i seguenti canali: 🌐 Qui su LinkedIn. Inviami un messaggio privato. 🌐 Per mail all'indirizzo: antonino@digitalsuite.eu 🌐 Per telefono: 342 8023594 🌐 Su Skype: ant.sapienza  Sarà un piacere offrirle un ""caffè"" e raccontarle dei nostri prodotti innovativi e della nostra azienda.  Cordiali saluti.  Antonino Sapienza Sales Director DigitalSuite Italia Via Luigi Razza, 8, 20124 Milano  https://www.linkedin.com/events/iltempodiuncaff-tiraccontolenos7165331610895167489/comments/",INBOX
2-M2RhMTgwY2UtMzY3ZS00ZTRhLTkwYWUtNmNiZGIxMDMwNjllXzAxMw==,,Antonino Sapienza,https://www.linkedin.com/in/antonino-sapienza,Davide Consiglio,https://www.linkedin.com/in/davideconsiglio,2024-01-18 15:50:52 UTC,,"Buonasera Davide,  la ringrazio per aver partecipato al nostro evento LinkedIn del 16 gennaio: “Best practices governo del credito: sinergie tra professionisti e strumenti”.  Sul mio profilo troverà la registrazione dell'evento.    Le riporto anche il link dove può consultare e scaricare le slide presentate.  https://creditsuite.eu/slide-webinar-creditsuite/  Abbiamo discusso delle ""best practices"" nel governo del credito e delle relazioni tra professionalità e strumenti innovativi di settore, presentando le novità di ""CreditSuite"" la nostra piattaforma di gestione e recupero del Credito.  Se non avesse avuto modo di partecipare o richiedesse un approfondimento non esiti a contattarmi per un nuovo incontro informativo e conoscitivo dedicato.  Nel frattempo colgo l'occasione per ringraziarla nuovamente ed augurale buon lavoro.  Cordiali saluti.   Antonino Sapienza Sales Director DigitalSuite Italia Via Luigi Razza, 8, 20124 Milano Mobile 342 8023594  Chi siamo: https://www.digitalsuite.eu/  Sito CreditSuite: https://www.creditsuite.eu",INBOX
2-ZjJkMDVjNWMtMDdlZS00OWNiLWI1MzYtOGQ1NTA3ZWNjM2YwXzAxMw==,,Manfredi Urciuoli,https://www.linkedin.com/in/manfrediurciuoli,Davide Consiglio,https://www.linkedin.com/in/davideconsiglio,2024-02-26 17:45:36 UTC,,"Grazie per aver accettato la richiesta di collegamento. Mi farebbe piacere, e sarei lusingato. se cominciassi a seguire, ossia cliccare su ""Segui"", il profilo LinkedIn di ILS - Industrialized Litigation Services, Start-up che ho costituito, specializzata nella gestione del contenzioso giudiziale di compagnie assicurative e di banche/società finanziarie https://www.linkedin.com/company/ils-industrialized-litigation-services Saresti così gentile da farlo? Grazie mille ;-)",INBOX
2-ZjJkMDVjNWMtMDdlZS00OWNiLWI1MzYtOGQ1NTA3ZWNjM2YwXzAxMw==,,Manfredi Urciuoli,https://www.linkedin.com/in/manfrediurciuoli,Davide Consiglio,https://www.linkedin.com/in/davideconsiglio,2023-02-27 19:28:43 UTC,,"Grazie per aver accettato la richiesta di collegamento. Mi farebbe piacere / sarei lusingato se cominciassi a seguire, ossia cliccare ""Segui"" al profilo LinkedIn, ILS - Industrialized Litigation Services, Start-up che ho costituito specializzata nella gestione del contenzioso giudiziale delle compagnie assicurative https://www.linkedin.com/company/ils-industrialized-litigation-services Saresti così gentile da farlo?  Grazie mille ;-)",INBOX
2-MTAwOTM4NDItODU2Yy00OTA4LTgwZDktOWYyMzM0NTdmYTA2XzAxMw==,,Davide Consiglio,https://www.linkedin.com/in/davideconsiglio,Maddalena Amoruso,https://www.linkedin.com/in/amoruso,2024-02-24 19:50:19 UTC,,Top! In bocca al lupo ,INBOX
2-MTAwOTM4NDItODU2Yy00OTA4LTgwZDktOWYyMzM0NTdmYTA2XzAxMw==,,Davide Consiglio,https://www.linkedin.com/in/davideconsiglio,Maddalena Amoruso,https://www.linkedin.com/in/amoruso,2024-02-24 19:50:01 UTC,,👍,INBOX
2-MTAwOTM4NDItODU2Yy00OTA4LTgwZDktOWYyMzM0NTdmYTA2XzAxMw==,,Maddalena Amoruso,https://www.linkedin.com/in/amoruso,Davide Consiglio,https://www.linkedin.com/in/davideconsiglio,2024-02-24 18:51:42 UTC,,Grazie Davide! To make a long story short: mi sembra di essere passata dalla promozione alla serie A. Mi piace molto sto lavorando tantissimo!,INBOX
2-MTAwOTM4NDItODU2Yy00OTA4LTgwZDktOWYyMzM0NTdmYTA2XzAxMw==,,Davide Consiglio,https://www.linkedin.com/in/davideconsiglio,Maddalena Amoruso,https://www.linkedin.com/in/amoruso,2024-02-24 18:35:08 UTC,,Come ti trovi? First impression? ,INBOX
2-MTAwOTM4NDItODU2Yy00OTA4LTgwZDktOWYyMzM0NTdmYTA2XzAxMw==,,Davide Consiglio,https://www.linkedin.com/in/davideconsiglio,Maddalena Amoruso,https://www.linkedin.com/in/amoruso,2024-02-24 18:34:57 UTC,,Congratulazioni Maddalena Intesa non è cosa da poco nel nostro mestiere? I migliori vanno sempre avanti ,INBOX
2-Mjg5NDljNmYtMWViNC00ZTExLWJlNGYtNjcxMDhmMDNjYmY3XzAxMw==,,Davide Consiglio,https://www.linkedin.com/in/davideconsiglio,Anna Nozza,https://www.linkedin.com/in/anna-nozza,2024-02-10 20:52:20 UTC,,Immagino l'agenda di questo mese...  Bello c'era un parterre de rois a partire da Mario Monti in poi... :-) tema interessante e anche lo speech di Sesana (Donnet non c'era) sul valore della partnership con Bocconi molto sentito.  Ma la sera prima con Davide Serra molto più scoppiettante! Ne ha sparate 4 5 topiche...  A presto! Buona domenica D,INBOX
2-Mjg5NDljNmYtMWViNC00ZTExLWJlNGYtNjcxMDhmMDNjYmY3XzAxMw==,,Anna Nozza,https://www.linkedin.com/in/anna-nozza,Davide Consiglio,https://www.linkedin.com/in/davideconsiglio,2024-02-07 18:24:34 UTC,,Purtroppo questa sera mi hanno bloccato in ufficio e non sono riuscita ad andare alla serata Bocconi. Se ci sei stato mi racconterai. A presto!,INBOX
2-Mjg5NDljNmYtMWViNC00ZTExLWJlNGYtNjcxMDhmMDNjYmY3XzAxMw==,,Davide Consiglio,https://www.linkedin.com/in/davideconsiglio,Anna Nozza,https://www.linkedin.com/in/anna-nozza,2024-01-21 20:53:42 UTC,,In effetti! 😃 Dovrei esserci - a presto ciao Davide ,INBOX
2-Mjg5NDljNmYtMWViNC00ZTExLWJlNGYtNjcxMDhmMDNjYmY3XzAxMw==,,Anna Nozza,https://www.linkedin.com/in/anna-nozza,Davide Consiglio,https://www.linkedin.com/in/davideconsiglio,2024-01-21 17:47:34 UTC,,"Davide grazie mille! Molto apprezzato.  Sì, ricevo le mail, ma ti confesso che non sono molto presente alle cene Alumni. Ottimo se c’è sempre un gruppo Generali. Sarà stimolo a partecipare!   Mi sono però iscritta all’evento del 7 febbraio. Non potevo non farlo 😀  A presto!  Anna",INBOX
2-Mjg5NDljNmYtMWViNC00ZTExLWJlNGYtNjcxMDhmMDNjYmY3XzAxMw==,,Davide Consiglio,https://www.linkedin.com/in/davideconsiglio,Anna Nozza,https://www.linkedin.com/in/anna-nozza,2024-01-21 14:38:30 UTC,,"Cara Anna, grazie per la connessione!   Ho pensato - e mi sono permesso di connettermi - chissà che magari … in un futuro prossimo le nostre strade professionali si incrocino :-)   Scherzi a parte è un vero piacere e ti prego di considerarmi a tua disposizione per qualsiasi cosa pre onboarding.   Ho visto che siamo entrambi Alumni Bocconi, ci tenevo a segnalarti che ai dinner speech mensili dell’associazione, di solito, c’è sempre una piccola nostra rappresentanza (io e Raffo da GIT, qualcuno da GHO, oltre a Sironi, quasi sempre, e a volte la Possa). Non so se ricevi le e-mail ma per tua info la prossima cena è il 6 febbraio con Davide Serra.  Un caro saluto e a presto, DC ",INBOX
2-ZDZmMDNhZDgtMDI4MS00NTQ3LWEwOTgtYzE0YTRlZjk4YWQ1XzAxMg==,,Alessandro Maggioni,https://www.linkedin.com/in/alessandro-maggioni-36135121,Davide Consiglio,https://www.linkedin.com/in/davideconsiglio,2024-02-06 15:50:46 UTC,,"Ciao Davide, come stai?  Sono interessato alla posizione di ""Data Analytics Project Manager"" in Generali (vedi sotto) e ti volevo chiedere se è parte del tuo team e se ne possiamo parlare insieme.  Grazie  Alessandro  https://www.linkedin.com/jobs/view/3811934339/?refId=bwlJTLWJT6e3y8mWnUPS9A%3D%3D&trackingId=gneprrNDRbinUMCYZU6Dgg%3D%3D",INBOX
2-ZDZmMDNhZDgtMDI4MS00NTQ3LWEwOTgtYzE0YTRlZjk4YWQ1XzAxMg==,,Alessandro Maggioni,https://www.linkedin.com/in/alessandro-maggioni-36135121,Davide Consiglio,https://www.linkedin.com/in/davideconsiglio,2023-03-22 17:48:55 UTC,,Grazie!,INBOX
2-ZDZmMDNhZDgtMDI4MS00NTQ3LWEwOTgtYzE0YTRlZjk4YWQ1XzAxMg==,,Davide Consiglio,https://www.linkedin.com/in/davideconsiglio,Alessandro Maggioni,https://www.linkedin.com/in/alessandro-maggioni-36135121,2023-03-22 17:32:47 UTC,,Per favore scrivimi a davide.consiglio@generali.com e ti faccio fissare,INBOX
2-ZDZmMDNhZDgtMDI4MS00NTQ3LWEwOTgtYzE0YTRlZjk4YWQ1XzAxMg==,,Davide Consiglio,https://www.linkedin.com/in/davideconsiglio,Alessandro Maggioni,https://www.linkedin.com/in/alessandro-maggioni-36135121,2023-03-22 17:32:29 UTC,,Ciao Alessandro certo ,INBOX
