CONVERSATION ID,CONVERSATION TITLE,FROM,SENDER PROFILE URL,TO,RECIPIENT PROFILE URLS,DATE,SUBJECT,CONTENT,FOLDER
2-YjQwNTVlYzktY2ZiMC01MmQ5LWJiOTQtMmJlMjJjMGEwYTg2XzAxMw==,,Debora Di Vittorio,,Davide Consiglio,https://www.linkedin.com/in/davideconsiglio,2020-06-10 03:01:52 UTC,,"<p class=""spinmail-quill-editor__spin-break"">Ciao,</p><p class=""spinmail-quill-editor__spin-break""><br></p><p class=""spinmail-quill-editor__spin-break"">cerchi<strong> figure altamente specializzate </strong>da inserire nel tuo organico?</p><p class=""spinmail-quill-editor__spin-break""><br></p><p class=""spinmail-quill-editor__spin-break"">In Italia sono molte le aziende alla ricerca di profili tecnici in linea con i loro fabbisogni, ma spesso è difficile trovare professionisti qualificati.</p><p class=""spinmail-quill-editor__spin-break""><br></p><p class=""spinmail-quill-editor__spin-break""><strong>Scopri subito i vantaggi di </strong><a rel=""noopener"" href=""https://sistemaits.it/?li_fat_id=7a76701a-5543-464a-baf4-273c1323e1d5"" target=""_blank""><strong>ITS</strong></a>: i percorsi post diploma progettati per offrire una formazione tecnica altamente qualificata che permette l’inserimento nei settori strategici del sistema economico e produttivo italiano.</p><p class=""spinmail-quill-editor__spin-break""><br></p><p class=""spinmail-quill-editor__spin-break"">Gli <strong>Istituti Tecnici Superiori</strong> nascono infatti dall’analisi dei<strong> fabbisogni occupazionali delle imprese</strong> e consentono di ritagliare la formazione esattamente sul lavoro. Anche se nel nostro paese rappresentano ancora una nicchia, in realtà i numeri sono in costante crescita e confermano il successo degli ITS:</p><p class=""spinmail-quill-editor__spin-break""><br></p><ul><li>104 gli Istituti in tutta Italia</li><li>16.447 iscritti</li><li>33 milioni di risorse finanziare assegnate agli ITS dal Ministero dell’Istruzione</li></ul><p class=""spinmail-quill-editor__spin-break""><br></p><p class=""spinmail-quill-editor__spin-break"">Gli ITS rappresentano oggi la realtà formativa del futuro, <strong>la fucina delle migliori energie dell'Italia. </strong></p><p class=""spinmail-quill-editor__spin-break"">Una scommessa vincente per il mondo della<strong> formazione professionalizzante</strong> che può diventare un prezioso asset strategico per la tua impresa.</p><p class=""spinmail-quill-editor__spin-break""><br></p><p class=""spinmail-quill-editor__spin-break"">È arrivato il momento di collaborare con <strong>ITS</strong>: clicca qui e scopri come fare!</p>",ARCHIVE
2-MGY5YjhlZWQtOWRmMC00YTVmLTk2NmItODRhOWNjNjQ1ODYyXzAxMg==,,⛳ Michael Saruggia,https://www.linkedin.com/in/michaelsaruggia,Davide Consiglio,https://www.linkedin.com/in/davideconsiglio,2020-06-05 08:11:38 UTC,,"Buongiorno Davide,  Ho scritto a Lei proprio perché so che sono gli uomini e le donne di business a portare il cambiamento.  Mi chiamo Michael e mi occupo di Intelligenza Artificiale.  Come può immaginare l'Italia non è molto avanti in questo settore.  Il problema di questa tecnologia è il suo POTENZIALE...  Non è nemmeno paragonabile alla rivoluzione che ha portato internet e.. forse si avvicina quella dell’ELETTRICITÀ.  USA e Cina stanno investendo miliardi nella ricerca… per molti è la nuova guerra fredda.  Nel mio piccolo sta cercando di dare il mio contributo… la mia missione è sempre stata portare l’AI in Italia.  Per questo motivo ho deciso di invitare GRATUITAMENTE i manager italiani a prenderne parte.  Da qualche mese ho aperto una piccola newsletter… dove condivido il mio lavoro su dati, AI e il loro impatto su business e società.  Scritta proprio per i business leader Italiani.  Per chi è interessato alla strategia, alla visione e senza mai scendere nei tecnicismi.  (centinaia di iscritti di società come Tim, Tiscali, Unibocconi, McKinsey, Microsoft, Luiss etc… )  Ecco il link d’invito -- > http://go.phot.re/P33PA  Cercando di dare il massimo, Michael",ARCHIVE
2-NDJmY2VjOWYtNWE2YS00NWE5LWJiNTMtZDZkYmI3OTczMzkwXzAxMA==,,Rossella Arcangeli,https://www.linkedin.com/in/rossella-arcangeli,Davide Consiglio,https://www.linkedin.com/in/davideconsiglio,2020-06-03 13:56:34 UTC,,"Buonasera dott. Consiglio, la ringrazio per il collegamento. Mi piacerebbe parlarle delle soluzioni innovative che, come Scai Finance, proponiamo alle aziende. Ci occupiamo di servizi riguardanti l'Hyperautomation, Risk Management, Modern BI e Advanced Analytics. Tutti questi servizi possono essere d'aiuto in diversi ambiti oltre a quello IT, come quelli commerciali o legati al marketing. Se fosse interessato le chiederei un contatto email a cui mandare informazioni più dettagliate. Per il momento la ringrazio. Attendo una sua risposta. Saluti,  Rossella Arcangeli",ARCHIVE
2-MTQ4MjE1YmEtM2UwNC00OWRlLTlkYTAtNzJiN2NhZWZmMmVjXzAxMw==,,Antonella Buccolieri,https://www.linkedin.com/in/antonellabuccolieri,Davide Consiglio,https://www.linkedin.com/in/davideconsiglio,2020-05-29 14:33:18 UTC,,"Salve Davide,   spero che abbia ricevuto la mia mail e di poterla sentire presto.   Buon week end.   Antonella ",ARCHIVE
2-ZmZiYmVmZGUtMDRmNy01M2RiLTllZmEtNjJhYWZhOGE3ZjFiXzAxMw==,,Antonella Buccolieri,https://www.linkedin.com/in/antonellabuccolieri,Davide Consiglio,https://www.linkedin.com/in/davideconsiglio,2020-05-29 14:07:39 UTC,Davide Consiglio | Richiesta di contatto,"Buon pomeriggio Davide,   Sono Antonella Buccolieri e in Salesforce mi occupo di sviluppo digitale per gruppi bancari e assicurativi.  Ho notato il suo ruolo all'interno di Generali Italia e data la sua esperienza e responsabilità mi piacerebbe invitarla ad un momento di presentazione nelle prossime settimane.  Salesforce è cresciuto rapidamente a livello internazionale e nazionale nel mondo dei servizi finanziari, diventando partner tecnologico di riferimento, e nello specifico la nostra collaborazione con il Gruppo Generali a livello mondiale si sta ampliando notevolmente.   Proprio di recente abbiamo riscontrato interesse sulle soluzioni analytics e vorrei per questo darle un aggiornamento e scoprire insieme se possiamo supportarla nel raggiungimento dei suoi prossimi obiettivi.   Spero di sentirla presto,  Antonella   Antonella Buccolieri Financial Service Business Development Mobile: +393453450979 Mail: abuccolieri@salesforce.com Let's connect on LinkedIn!",ARCHIVE
2-ODM5OTBkMDYtNDU0MS00M2JiLWI2MmQtOGFmYWFiYTg1ODIxXzAxMA==,,Roberta Romano,https://www.linkedin.com/in/roberta-romano-902365144,Davide Consiglio,https://www.linkedin.com/in/davideconsiglio,2020-04-29 09:26:17 UTC,,"Buongiorno dott. Consiglio,  la ringrazio molto per aver accettato la mia connessione.  Le segnalo di averle inviato una mail, riguardo alle varie posizioni in ambito Big Data che ho notato aperte per la BU Advanced Analytics.  Ha avuto occasione di vederla? Grazie ancora, a presto.",ARCHIVE
2-NDQyYjRmNjYtMjE2Mi01YzZhLTgyNzUtMDU4NjlhZGIyYjhmXzAxMw==,,Francesca Felet,,Davide Consiglio,https://www.linkedin.com/in/davideconsiglio,2020-04-28 19:10:11 UTC,,"<p class=""spinmail-quill-editor__spin-break"">Hi Davide,&nbsp;</p><p class=""spinmail-quill-editor__spin-break"">&nbsp;</p><p class=""spinmail-quill-editor__spin-break"">Did you know that there are more than 35 million job seekers that visit LinkedIn Jobs every week? That's why more than 300,000+ companies, of all sizes, use LinkedIn Talent Solutions to find, source, and hire talent. With a network of over 630+ million members, you get access to more quality candidates, most of whom aren't visiting job boards.&nbsp;</p><p class=""spinmail-quill-editor__spin-break"">&nbsp;</p><p class=""spinmail-quill-editor__spin-break"">Whether you're trying to hire for hard to fill roles, build an enviable employer brand, or get more applicants for your jobs,<a rel=""noopener"" href=""https://business.linkedin.com/talent-solutions/cx/17/08/request-demo-lander?src=li-in&amp;veh=SPINxAleadxENGxInMailxSLxFindYourxBLx733xSPAINxITALYxEMEAx7010d000000if6wAAA&amp;trk=SPINxAleadxENGxInMailxSLxFindYourxBLx733xSPAINxITALYxEMEAx7010d000000if6wAAA&amp;cid=7010d000000if6wAAA&amp;utm_source=linkedin&amp;utm_medium=inmail&amp;utm_campaign=LHS_EML_20191106_LOL_A_LEAD_GLOBAL_EN_INMAIL&amp;mcid=6602526861434109952"" target=""_blank""> </a><a rel=""noopener"" href=""https://business.linkedin.com/talent-solutions/cx/17/08/request-demo-lander?src=li-in&amp;veh=SPINxAleadxENGxInMailxSLx35millionxBLx733xSPAINxITALYxEMEAx7010d000000if6wAAA&amp;trk=SPINxAleadxENGxInMailxSLx35millionxBLx733xSPAINxITALYxEMEAx7010d000000if6wAAA&amp;cid=7010d000000if6wAAA&amp;utm_source=linkedin&amp;utm_medium=inmail&amp;utm_campaign=LHS_EML_20191106_LOL_A_LEAD_GLOBAL_EN_INMAIL&amp;mcid=6602526911119839232"" target=""_blank"">LinkedIn Talent Solutions can help</a><a rel=""noopener"" href=""https://business.linkedin.com/talent-solutions/cx/17/08/request-demo-lander?src=li-in&amp;veh=SPINxAleadxENGxInMailxSLxFindYourxBLx733xSPAINxITALYxEMEAx7010d000000if6wAAA&amp;trk=SPINxAleadxENGxInMailxSLxFindYourxBLx733xSPAINxITALYxEMEAx7010d000000if6wAAA&amp;cid=7010d000000if6wAAA&amp;utm_source=linkedin&amp;utm_medium=inmail&amp;utm_campaign=LHS_EML_20191106_LOL_A_LEAD_GLOBAL_EN_INMAIL&amp;mcid=6602526861434109952"" target=""_blank""> </a>do the heavy lifting for you. You can:&nbsp;</p><p class=""spinmail-quill-editor__spin-break"">&nbsp;</p><ul><li><strong>Find talent</strong> using smart search filters to find relevant candidates faster&nbsp;</li><li><strong>Engage candidates</strong> via InMail, LinkedIn’s messaging platform and enjoy 3x higher response rates than email</li><li><strong>Post jobs</strong> that target high quality candidates who are open to new opportunities&nbsp;</li><li><strong>Attract candidates</strong> by boosting brand recognition and get more job applicants&nbsp;</li></ul><p class=""spinmail-quill-editor__spin-break"">&nbsp;</p><p class=""spinmail-quill-editor__spin-break"">Engage the world’s most qualified talent pool today.&nbsp;</p><p class=""spinmail-quill-editor__spin-break""><br></p><p class=""spinmail-quill-editor__spin-break"">Best Regards,&nbsp;</p><p class=""spinmail-quill-editor__spin-break"">Francesca Felet</p><p class=""spinmail-quill-editor__spin-break"">LinkedIn Talent Solutions</p>",ARCHIVE
2-MzA0YWFkNzEtNzllMi01MjVhLWI2YzAtOWIwNDE4YjBlNjkwXzAxMw==,,Prof. David Costa,,Davide Consiglio,https://www.linkedin.com/in/davideconsiglio,2020-04-25 13:25:20 UTC,,"<p>Hello Davide,</p><p>I am pleased to invite you to explore the York Online MBA in Leadership and Management: you can now complete your MBA Online in 1 Year.</p><p>The MBA is offered online in exclusive partnership between&nbsp;York St John University in York, England and Robert Kennedy College in Zürich, Switzerland.</p><p>After completing the MBA, you will receive the same award as a student studying full time at the York St John University,a prestigious civic university with roots going back to the 1840s .&nbsp;York St John University degrees are recognised Worldwide.</p><p>Request the course catalogue&nbsp;for more information about our programmes.</p><p>Best Regards,</p><p>Prof. David Costa, LL.M, MBA, PhD</p><p>York St John University MBAs</p><p>in Exclusive Partnership with</p><p>Robert Kennedy College</p><p>Technoparkstrasse 1 8005 Zürich</p><p>Tel. +41 844 007 007 Fax +41 844 007 008</p>",ARCHIVE
2-MmE4ZjgzNDctODA4Yy00MjE2LWFhMzMtMDJiMTBiN2Q4YTk4XzAxMA==,,Martin Smit,https://www.linkedin.com/in/martin-smit-530528b,Davide Consiglio,https://www.linkedin.com/in/davideconsiglio,2020-04-17 08:46:12 UTC,,Thanks for accepting. Highly appreciated Davide.,ARCHIVE
2-OWIyZTk1NWUtYTVjYi01NmI1LWIwMDItMGM1ZTJlYTE2NjM3XzAxMg==,,Martin Smit,https://www.linkedin.com/in/martin-smit-530528b,Davide Consiglio,https://www.linkedin.com/in/davideconsiglio,2020-04-16 08:22:25 UTC,,"Dear Davide, we’ve never met in person but we are both active in the financial and insurance industry and you have great experience in our sector. I would like to engage to share insights in the future. Can we connect? Kind regards, Martin.",ARCHIVE
2-NWZmOTRkNDEtNWQ5OS00OWUwLTgyNjQtNTc0ZWIxZTVhZTI3XzAxMw==,,Alexandra Arce Amador,https://www.linkedin.com/in/alexandra-arce-amador-192730a2,Davide Consiglio,https://www.linkedin.com/in/davideconsiglio,2020-04-14 10:11:35 UTC,,"Buongiorno Dott. Consiglio,  Sono Alexandra Arce senior manager di AMARIS, una società di consulenza in ambito informatico e digital.   Ad oggi mi occupo del coordinamento delle attività IT, Marketing & Digital per l'ufficio di Milano, e avrei piacere ad incontrarla per conoscere meglio le attività delle quali si occupa per Generali e raccontarle di cosa si occupa Amaris al fine di trovare nuove sinergie.  Noi abbiamo lavorato già con Generali in Portogallo seguendo progetti in ambito sviluppo SW. Ho visto che avete una ricerche attive in linkedin di analisti, questo è un ambito dove lavoro ed avrei delle persone disponibili in consulenza.   Capisco il momento particolare che stiamo vivendo, ma mi farebbe piacere poter fissare un incontro conoscitivo in formato digitale (skype, hangouts, ecc) e valutare insieme eventuali future collaborazioni.    Rimango in attesa di un suo feedback e colgo l'occasione per augurarle una buona giornata. Alexandra Arce",ARCHIVE
2-MGM4ODE2NjMtMzBmZC00YzhkLWJlZTAtNjg0YzhiZGUxMTM1XzAxMg==,,Isabella David,https://www.linkedin.com/in/isabella-david-9996041a,Davide Consiglio,https://www.linkedin.com/in/davideconsiglio,2020-04-07 14:16:27 UTC,,Ahhh!lo hanno fatto loro...😥interessante il commento sotto della tipa che cerca investitori nella startup che cerca gli infermieri piu vicino,ARCHIVE
2-MGM4ODE2NjMtMzBmZC00YzhkLWJlZTAtNjg0YzhiZGUxMTM1XzAxMg==,,Isabella David,https://www.linkedin.com/in/isabella-david-9996041a,Davide Consiglio,https://www.linkedin.com/in/davideconsiglio,2020-04-06 16:30:02 UTC,,https://www-adnkronos-com.cdn.ampproject.org/c/s/www.adnkronos.com/salute/medicina/2020/04/06/esperto-medical-intelligence-per-intercettare-virus-emergenti_tnM3OEvGwP4RT9v4gNb32K_amp.html,ARCHIVE
2-MjY1ZjNiM2EtNzZmZS00MDY2LThhODgtODA4ZDA3YzdjZWVlXzAxMw==,,Angelo Durante,https://www.linkedin.com/in/angelo-durante-a56ab320,Davide Consiglio,https://www.linkedin.com/in/davideconsiglio,2020-04-07 06:40:23 UTC,,Grazie. In giornata le invierò il cv e procedo con la candidatura online.  Buona giornata AD,ARCHIVE
2-MjY1ZjNiM2EtNzZmZS00MDY2LThhODgtODA4ZDA3YzdjZWVlXzAxMw==,,Davide Consiglio,https://www.linkedin.com/in/davideconsiglio,Angelo Durante,https://www.linkedin.com/in/angelo-durante-a56ab320,2020-04-07 06:36:07 UTC,,"Buongiorno, certo, faccia la candidatura online e mandi il cv anche a me davide.consiglio@generali.com  Saluti  DC",ARCHIVE
2-MjY1ZjNiM2EtNzZmZS00MDY2LThhODgtODA4ZDA3YzdjZWVlXzAxMw==,,Angelo Durante,https://www.linkedin.com/in/angelo-durante-a56ab320,Davide Consiglio,https://www.linkedin.com/in/davideconsiglio,2020-04-07 06:36:07 UTC,,"Buongiorno dott.Consiglio,  La scrivo per la posizione ""Analitycs Business Lead"", la cui descrizione è in linea con la mia ricerca. Sono iscritto al Master Bicocca in ""BI&Big Data Analytics"". Se lo ritiene opportuno possiamo sentirci o semplicemente rimanere in contatto per il futuro. Grazie",ARCHIVE
2-YjVjN2VhYWYtMmNhOS01MmRiLTg2MzktMmQwNmZiNGNmNDE3XzAxMw==,,Paolo Scappatura,https://www.linkedin.com/in/paoloscappatura,Davide Consiglio,https://www.linkedin.com/in/davideconsiglio,2020-04-02 10:30:42 UTC,,"Salve Davide, Volevo connettere con lei su LinkedIn in modo da tenerla aggiornata sulle attivita' di Sprinklr, la piu' completa e potente tecnologia al mondo che analizza tutto quello che viene condiviso sui i canali di comunicazione moderna (testi non strutturati e immagini) La ringrazio  ",ARCHIVE
2-YzQwNmYxYTctMzQyNy01Yzk0LTk5NWUtZTg2M2RlM2Y4NmQ3XzAxMw==,,Carlo De Simone,https://www.linkedin.com/in/desimonec,Davide Consiglio,https://www.linkedin.com/in/davideconsiglio,2020-03-15 07:21:50 UTC,,"E' un piacere poter entrare in contatto con te e condividere idee, opinioni e attività. A presto. Carlo De Simone",ARCHIVE
2-ZGYzZjRkNDEtMjk1Yi01NTIxLTllY2UtNDAyOTVjMmMwYmNmXzAxMw==,,Christina Schiøtt Liaos,,Davide Consiglio,https://www.linkedin.com/in/davideconsiglio,2020-03-11 12:27:11 UTC,,"<p class=""spinmail-quill-editor__spin-break"">Dear Davide,</p><p class=""spinmail-quill-editor__spin-break""><br></p><p class=""spinmail-quill-editor__spin-break"">Imagine taking your international investment plans to a higher level.</p><p class=""spinmail-quill-editor__spin-break""><br></p><p class=""spinmail-quill-editor__spin-break"">Imagine settling in a location perfectly suited to your business. A place with:</p><ul><li>a creative economy and an innovative R&amp;D ecosystem that will support your most ambitious plans;</li><li>a world-class skills base and an education system renowned for producing top-tier talent;&nbsp;</li><li>government funding and business incentives worth over £26 billion in 2018 alone;</li><li>one of the lowest corporation tax rates in the G20; and</li><li>the number 1 ranking in Forbes' Best Countries for Business list.</li></ul><p class=""spinmail-quill-editor__spin-break""><br></p><p class=""spinmail-quill-editor__spin-break"">This place is the United Kingdom, and we’re ready to trade with you.</p><p class=""spinmail-quill-editor__spin-break""><br></p><p class=""spinmail-quill-editor__spin-break""><a rel=""noopener"" href=""https://invest.great.gov.uk/contact/?utm_source=linkedin&amp;utm_medium=paidsocial&amp;utm_content=europeq4_rumouredtobeinvesting_imlg_picture_de-nl-be-ch-ie-po-fr-it-es-pt-gr-dk-se-no&amp;utm_campaign=rtt"" target=""_blank"">We can help you set up in the UK</a></p><p class=""spinmail-quill-editor__spin-break"">It typically takes less than 5 days to set up a business in the UK. What’s more, our global team of experienced advisors will help you assess market opportunities, introduce you to the right contacts and give advice on recruitment, tax, business banking, and more.</p><p class=""spinmail-quill-editor__spin-break""><br></p><p class=""spinmail-quill-editor__spin-break"">It’s time to discover how you could grow your business from the UK- the no. 1 European destination for FDI. Send us an enquiry and one of our advisors will be in touch.</p><p class=""spinmail-quill-editor__spin-break""><br></p><p class=""spinmail-quill-editor__spin-break"">Christina Schiøtt Liaos</p><p class=""spinmail-quill-editor__spin-break"">European Foreign Direct Investment Lead</p><p class=""spinmail-quill-editor__spin-break"">UK Department for International Trade</p>",ARCHIVE
2-ODVkMzJkYzItN2RjNC01NjY5LTg5NTUtZWI2YWMwNjJmNWY4XzAxMw==,,Francesca Felet,,Davide Consiglio,https://www.linkedin.com/in/davideconsiglio,2020-02-28 18:54:56 UTC,,"<p class=""spinmail-quill-editor__spin-break"">Hi Davide,&nbsp;</p><p class=""spinmail-quill-editor__spin-break"">&nbsp;</p><p class=""spinmail-quill-editor__spin-break"">Did you know that there are more than 35 million job seekers that visit LinkedIn Jobs every week? That's why more than 300,000+ companies, of all sizes, use LinkedIn Talent Solutions to find, source, and hire talent. With a network of over 630+ million members, you get access to more quality candidates, most of whom aren't visiting job boards.&nbsp;</p><p class=""spinmail-quill-editor__spin-break"">&nbsp;</p><p class=""spinmail-quill-editor__spin-break"">Whether you're trying to hire for hard to fill roles, build an enviable employer brand, or get more applicants for your jobs,<a rel=""noopener"" href=""https://business.linkedin.com/talent-solutions/cx/17/08/request-demo-lander?src=li-in&amp;veh=SPINxAleadxENGxInMailxSLxFindYourxBLx733xSPAINxITALYxEMEAx7010d000000if6wAAA&amp;trk=SPINxAleadxENGxInMailxSLxFindYourxBLx733xSPAINxITALYxEMEAx7010d000000if6wAAA&amp;cid=7010d000000if6wAAA&amp;utm_source=linkedin&amp;utm_medium=inmail&amp;utm_campaign=LHS_EML_20191106_LOL_A_LEAD_GLOBAL_EN_INMAIL&amp;mcid=6602526861434109952"" target=""_blank""> LinkedIn Talent Solutions can help </a>do the heavy lifting for you. You can:&nbsp;</p><p class=""spinmail-quill-editor__spin-break"">&nbsp;</p><ul><li><strong>Find talent</strong> using smart search filters to find relevant candidates faster&nbsp;</li><li><strong>Engage candidates</strong> via InMail, LinkedIn’s messaging platform and enjoy 3x higher response rates than email</li><li><strong>Post jobs</strong> that target high quality candidates who are open to new opportunities&nbsp;</li><li><strong>Attract candidates</strong> by boosting brand recognition and get more job applicants&nbsp;</li></ul><p class=""spinmail-quill-editor__spin-break"">&nbsp;</p><p class=""spinmail-quill-editor__spin-break"">Engage the world’s most qualified talent pool today.&nbsp;</p><p class=""spinmail-quill-editor__spin-break""><br></p><p class=""spinmail-quill-editor__spin-break"">Best Regards,&nbsp;</p><p class=""spinmail-quill-editor__spin-break"">Francesca Felet&nbsp;</p><p class=""spinmail-quill-editor__spin-break"">LinkedIn Talent Solutions</p>",ARCHIVE
2-YzliYWNmZGYtNDI4NS01NzAyLWEzZmUtZDFmZTA0YjM1NTQ0XzAxMw==,,Didi Valerianova,,Davide Consiglio,https://www.linkedin.com/in/davideconsiglio,2020-01-26 09:41:26 UTC,,"<p class=""spinmail-quill-editor__spin-break"">Dear Davide,</p><p class=""spinmail-quill-editor__spin-break""><br></p><p class=""spinmail-quill-editor__spin-break"">I would like to invite you to join an <strong>exclusive networking cocktail</strong> in <strong>Milan</strong> on Tuesday, <strong>January 28</strong><sup><strong>th</strong></sup>, at The Westin Palace Milan. This boutique networking event will give you the opportunity to connect with some of the world’s top business schools, Executive MBA alumni and business leaders. </p><p class=""spinmail-quill-editor__spin-break"">&nbsp;</p><p class=""spinmail-quill-editor__spin-break"">·&nbsp;&nbsp;&nbsp;&nbsp;&nbsp;&nbsp;&nbsp;Join a <strong>panel discussion</strong> with Executive MBA alumni from international business schools;</p><p class=""spinmail-quill-editor__spin-break"">·&nbsp;&nbsp;&nbsp;&nbsp;&nbsp;&nbsp;&nbsp;Connect with executive education experts from business schools in the Top 50 Executive MBA rankings (Financial Times 2018) such as <strong>ESCP Europe, IMD, MIP Politecnico di Milano, University of Zurich, , IESE Global Executive MBA, IE Business School, London Business School </strong>and more;</p><p class=""spinmail-quill-editor__spin-break"">·&nbsp;&nbsp;&nbsp;&nbsp;&nbsp;&nbsp;&nbsp;Discuss your career path and ambitions with business experts from leading global and local organisations.</p><p class=""spinmail-quill-editor__spin-break"">&nbsp;</p><p class=""spinmail-quill-editor__spin-break"">Looking forward to having you with us!</p><p class=""spinmail-quill-editor__spin-break"">&nbsp;</p><p class=""spinmail-quill-editor__spin-break"">Kind regards,</p><p class=""spinmail-quill-editor__spin-break"">Didi Valerianova</p><p class=""spinmail-quill-editor__spin-break"">Event Manager - Premier Executive MBA&nbsp;</p>",ARCHIVE
