CONVERSATION ID,CONVERSATION TITLE,FROM,SENDER PROFILE URL,TO,RECIPIENT PROFILE URLS,DATE,SUBJECT,CONTENT,FOLDER
2-NjcyNzY4ZjQtYzNiMS01YzRhLTk1MTEtM2M0NDUxOTc1YWUyXzAwMA==,,Matt Stocker,https://www.linkedin.com/in/matthewstocker95,Davide Consiglio,https://www.linkedin.com/in/davideconsiglio,2018-03-14 10:38:46 UTC,,"Hi Davide,  Many thanks for accepting my connection request.  Did you receive my recent email in relation to the 2 Senior candidates within Big Data, AI & Advanced Analytics that I am currently representing? Keen to discuss the profiles and the possibility of a collaboration between us in more detail.   Please advise when you would be available to speak.  Best regards, Matthew",ARCHIVE
2-NjcyNzY4ZjQtYzNiMS01YzRhLTk1MTEtM2M0NDUxOTc1YWUyXzAwMA==,,Matt Stocker,https://www.linkedin.com/in/matthewstocker95,Davide Consiglio,https://www.linkedin.com/in/davideconsiglio,2018-03-14 10:22:48 UTC,,"Hi Davide,   Following on from my recent email, I feel it would be beneficial for us to connect.  BR Matthew",ARCHIVE
2-NjE2OGRhZjMtZGRhOS01YjM3LTkzZGYtZmVlZThkMDM1ZjQyXzAwMA==,,Marco Ferrarini,https://www.linkedin.com/in/marco-ferrarini-61078070,Davide Consiglio,https://www.linkedin.com/in/davideconsiglio,2018-03-14 07:52:07 UTC,,"Buongiorno Davide, Grazie per aver accettato la richiesta di connessione.   Mi chiamo Marco Ferrarini e sono un matematico con esperienza in simulazione di processi stocastici.   Al momento lavoro come data analyst presso un centro di ricerca a Milano da quasi un anno, e nel mentre ho terminato la scrittuta della tesi di PhD presso l'università di Leeds, UK.  Sono stato contattato per una possibile posizione presso BCG Gamma a Milano da un'agenzia di recruitment e, vista la sua esperienza professionale, ho pensato di scriverle. Vorrei davvero avere questo lavoro, e per questo mi farebbe piacere fare due chiacchiere al telefono per poter essere il più preparato possibile per il possibile colloquio.  Sarebbe disponibile? Se sì, potrebbe lasciarmi un numero di telefono?  Grazie infinite, Marco",ARCHIVE
2-YmRjZTYyZjMtOGJhMy01MmQ4LWExZDktYjU1MmJhOGUxNzYxXzAwMA==,,LinkedIn Marketing Solutions,,Davide Consiglio,https://www.linkedin.com/in/davideconsiglio,2018-03-09 06:59:18 UTC,,"Davide,With LinkedIn advertising you can engage with business leaders and decision makers, all in one place.If you would like to give LinkedIn advertising a try, click the button below to request your credits.With LinkedIn ads, you can:Reach over 500 million members based on job title, function, industry, and moreAttract new customers directly from the LinkedIn homepage and mobile feedMeasure results and optimize campaigns in the Campaign Manager toolSuccess awaits on the world&rsquo;s largest professional network.Sincerely,LinkedIn Marketing Solutions",ARCHIVE
2-YzQ3OWVlNGMtYzc4Mi01YzI2LWJjMDctNzBlODE4NzllZmIyXzAwMA==,,"Filip Vanderhaegen, CFA",https://www.linkedin.com/in/filipvanderhaegen,Davide Consiglio,https://www.linkedin.com/in/davideconsiglio,2018-03-08 17:13:52 UTC,,"Hi Davide - How are things? I wanted to introduce you to a contact of mine, who wants to speak. Which email address could I use? Thanks!",ARCHIVE
2-ZWQ5ZjA1YTMtYjY5NS01ZGYxLTkyY2YtMjg1OTQwN2Q3MzkxXzAwMA==,,Nicola Roteglia,https://www.linkedin.com/in/roteglia,Davide Consiglio,https://www.linkedin.com/in/davideconsiglio,2018-03-02 18:03:37 UTC,,"E' stato un piacere assistere alla round table organizzato con Generali in Ambasciata ieri sera. Da sempre interessato ad AI e Machine Learnig ho partecipato  diversi progeti con Centrica e Hive, incluso un anno su Connected Insurance.  Nicola ",ARCHIVE
2-NGViZWJkNGUtNjhiMy01ZTViLTk3MzEtODQ5NTViNGFkZWIxXzAwMA==,,Isabella Gandini,https://www.linkedin.com/in/isabellagandini,Davide Consiglio,https://www.linkedin.com/in/davideconsiglio,2018-03-01 23:39:03 UTC,,Vorrei aggiungerti alla mia rete professionale su LinkedIn. —Isabella,ARCHIVE
2-MTE0NzZlYWQtMjQwYi01NGEyLThkYzgtMmI1YjYwMTYwOGZhXzAwMA==,,Andrea Coppola,,Davide Consiglio,https://www.linkedin.com/in/davideconsiglio,2018-02-28 15:30:50 UTC,,"Hello&nbsp;Davide,IE, one of the leading higher education institutions in the world, is pleased to invite you to a unique Executive Breakfast ""The Future of Finance in the Era of 4IR"" in Milan.Much has been talked about Industrial Revolutions that has taken place since the 18th century but not so much about Finance Revolutions. Yes, clearly Industrial Revolutions had to be funded and clearly the way money arrived to make possible those revolutions has changed dramatically.First, Second and Third Industrial revolutions have seen energy, industries and communications to change dramatically. At the same time finance has evolved from merchant Banks to Capital Markets and Structured Finance. Fourth industrial revolution is said to bring renewable energy definitely together with internet of things, biotechnology and Artificial Intelligence. Regarding Finance, clearly Fintech is going to help change our lives.AgendaFriday, March 23, 2018 at 09:00 hrs.Executive Breakfast ""The Future of Finance in the Era of 4IR""NH Milano Touring Via Iginio Ugo Tarchetti 2, 20121 Milan.About the speakerWith 8 years of teaching experience at IE and more than 20 at other institutions, Professor Rafael Martins de Lima is an expert in Finance focusing on Financial Markets, Risk Management and Financial Management. Professionally, he started working developing Artificial intelligence systems for Procter &amp; Gamble, but very soon he switched his career to Management and Banking, firstly at McKinsey &amp; Company as a consultant, following at Amadeus as Business Development Manager and after at Banco Santander.There, he reached the level of Managing Director (Subdirector General Adjunto) working in America, Europe and Africa in areas such as Corporate Finance, Capital Markets, Consumer Finance and Risk Management. Currently he runs Hera W2R (Waste to Resource), company that works in the fields of Renewable Energy and Carbon Finance. His dual education on Finance and Engineering combined with his experience in consulting, banking and industry makes him a deep academic with a direct to the point view on real life practice.Please confirm your attendance as places are limited.We look forward to meeting you soon!Best regards,Andrea CoppolaDirector IE Office Italy, Balkans, San Marino, Vatican CityAndrea.Coppola@ie.edu",ARCHIVE
2-NzFlOTE4MTYtOTQ1ZC01MTc3LWJjNjUtZTliMmQ0NTRmMzg4XzAwMA==,,Lorenzo Savasta,https://www.linkedin.com/in/lorenzosavasta,Davide Consiglio,https://www.linkedin.com/in/davideconsiglio,2018-02-22 11:13:33 UTC,,"Buongiorno Davide,  ci siamo incontrati ieri all'Information Technology Forum. Credo che aggiungerti alla mia rete LinkedIn possa essere molto utile per il mio presente e futuro professionale. A presto!",ARCHIVE
2-OWZjYzE2YjctZGMzNi01ZGM2LWFmZjYtZGE3ODU3OGYxNjFlXzAwMA==,,Luigi Zanchi,https://www.linkedin.com/in/luigizanchi,Davide Consiglio,https://www.linkedin.com/in/davideconsiglio,2018-02-21 15:49:23 UTC,,,ARCHIVE
2-NTM1ZDgyMjUtN2Y5My01NDg2LWFiNTctMWFmYTI5MmJiNDk0XzAwMA==,,Camille Turquois,https://www.linkedin.com/in/camille-turquois-marketing-manager,Davide Consiglio,https://www.linkedin.com/in/davideconsiglio,2018-02-21 12:55:45 UTC,,"Salve Davide,  Non abbiamo ancora avuto il piacere di conoscerci ma la aggiungo come contatto dato che lavoro anche nel ambito del digital.  Un cordiale saluto, Camille",ARCHIVE
2-OGQxODZlNTMtZjg3MC01MGYxLTljZjQtMjEyOTcwZDJlNjIwXzAwMA==,,Dr. Johanna Nemson,https://www.linkedin.com/in/dr-johanna-nemson-341b203,Davide Consiglio,https://www.linkedin.com/in/davideconsiglio,2018-01-21 18:35:40 UTC,,You are in our hearts!!,ARCHIVE
2-OGQxODZlNTMtZjg3MC01MGYxLTljZjQtMjEyOTcwZDJlNjIwXzAwMA==,,Davide Consiglio,https://www.linkedin.com/in/davideconsiglio,Dr. Johanna Nemson,https://www.linkedin.com/in/dr-johanna-nemson-341b203,2018-01-21 18:30:54 UTC,,Thanks Johanna! All is good but well yes the BCG family is missed ;-)   All the best D,ARCHIVE
2-OGQxODZlNTMtZjg3MC01MGYxLTljZjQtMjEyOTcwZDJlNjIwXzAwMA==,,Dr. Johanna Nemson,https://www.linkedin.com/in/dr-johanna-nemson-341b203,Davide Consiglio,https://www.linkedin.com/in/davideconsiglio,2018-01-19 12:46:23 UTC,,"Happy birthday, Davide!! Hope you are enjoying the new role...  All the best Johanna",ARCHIVE
2-Zjg5OTgzMWYtZWQyZi01NzU5LWE4OGQtOGU2OTAwMDdjODE5XzAwMA==,,Davide Consiglio,https://www.linkedin.com/in/davideconsiglio,"Eddy Reynolds,Bas van Heel,Jon Taylor,Diego Garaycochea,David Hynam,Tim Kunde,John  McGuigan,Barry O'Dwyer,Alexander Vollert,Miguel Ortiz,Greg Willmott,Anne Kirk,Adrian Durham,Tim Dornan,Shirine Khoury-Haq,Rob H.,Fabio Sbianchi,Colm Holmes,Seraina Macia,Michael Baker,Victoria Morton,Bruno Paulson,Bruno Herdeiro,Hannah Gore-Randall,Angus Eaton,Warren Macdonald","https://www.linkedin.com/in/eddy-reynolds-82a46330,https://www.linkedin.com/in/basvanheelnl,https://www.linkedin.com/in/jon-taylor-296483,https://www.linkedin.com/in/diego-garaycochea,https://www.linkedin.com/in/david-hynam,https://www.linkedin.com/in/timkunde,https://www.linkedin.com/in/john-mcguigan-1164083a,https://www.linkedin.com/in/barry-o-dwyer-6a69854,https://www.linkedin.com/in/alexander-vollert,https://www.linkedin.com/in/miguel-ortiz-04578b,https://www.linkedin.com/in/greg-willmott-44a937,https://www.linkedin.com/in/anne-kirk-1a986ba,https://www.linkedin.com/in/adrian-durham-b4653a10,https://www.linkedin.com/in/timdornan,https://www.linkedin.com/in/shirine-khoury-haq-92b5a11,https://www.linkedin.com/in/robhoughton,https://www.linkedin.com/in/fabio-sbianchi-1907a3129,https://www.linkedin.com/in/colm-holmes-5a864412b,https://www.linkedin.com/in/serainamacia,https://www.linkedin.com/in/michael-baker-80484617,https://www.linkedin.com/in/mortonvictoria,https://www.linkedin.com/in/bruno-paulson-9303251a,https://www.linkedin.com/in/bruno-herdeiro-7435a320,https://www.linkedin.com/in/hannah-gore-randall-695a6320,https://www.linkedin.com/in/angus-eaton-33872a22,https://www.linkedin.com/in/warrenmacdonald",2017-12-17 18:23:02 UTC,,Congrats Miguel! Sounds amazing  Let us stay in touch  Best D,ARCHIVE
2-Zjg5OTgzMWYtZWQyZi01NzU5LWE4OGQtOGU2OTAwMDdjODE5XzAwMA==,,Miguel Ortiz,https://www.linkedin.com/in/miguel-ortiz-04578b,"Eddy Reynolds,Bas van Heel,Jon Taylor,Diego Garaycochea,David Hynam,Tim Kunde,John  McGuigan,Barry O'Dwyer,Alexander Vollert,Greg Willmott,Anne Kirk,Adrian Durham,Tim Dornan,Shirine Khoury-Haq,Rob H.,Fabio Sbianchi,Colm Holmes,Seraina Macia,Michael Baker,Victoria Morton,Bruno Paulson,Bruno Herdeiro,Hannah Gore-Randall,Angus Eaton,Warren Macdonald","https://www.linkedin.com/in/eddy-reynolds-82a46330,https://www.linkedin.com/in/basvanheelnl,https://www.linkedin.com/in/jon-taylor-296483,https://www.linkedin.com/in/diego-garaycochea,https://www.linkedin.com/in/david-hynam,https://www.linkedin.com/in/timkunde,https://www.linkedin.com/in/john-mcguigan-1164083a,https://www.linkedin.com/in/barry-o-dwyer-6a69854,https://www.linkedin.com/in/alexander-vollert,https://www.linkedin.com/in/greg-willmott-44a937,https://www.linkedin.com/in/anne-kirk-1a986ba,https://www.linkedin.com/in/adrian-durham-b4653a10,https://www.linkedin.com/in/timdornan,https://www.linkedin.com/in/shirine-khoury-haq-92b5a11,https://www.linkedin.com/in/robhoughton,https://www.linkedin.com/in/fabio-sbianchi-1907a3129,https://www.linkedin.com/in/colm-holmes-5a864412b,https://www.linkedin.com/in/serainamacia,https://www.linkedin.com/in/michael-baker-80484617,https://www.linkedin.com/in/mortonvictoria,https://www.linkedin.com/in/bruno-paulson-9303251a,https://www.linkedin.com/in/bruno-herdeiro-7435a320,https://www.linkedin.com/in/hannah-gore-randall-695a6320,https://www.linkedin.com/in/angus-eaton-33872a22,https://www.linkedin.com/in/warrenmacdonald",2017-12-17 16:42:19 UTC,,Thanks. You too.,ARCHIVE
2-YzUxMGYzOTQtNTg3Ny01MmE0LTgxNDAtZWQ5ZjRiZmZlY2RkXzAwMA==,,Riccardo Trubiani,https://www.linkedin.com/in/riccardotrubiani,Davide Consiglio,https://www.linkedin.com/in/davideconsiglio,2018-01-16 21:08:31 UTC,,"Buonasera Dott.Consiglio,  innanzitutto complimenti per il nuovo ruolo. Ho cambiato anche io posizione recentemente passando a seguire il mercato delle soluzioni di AI nei financial services e seguo anche Generali Italia.   Sarebbe disponibile per un incontro per confrontarci su eventuali aree e progetti di collaborazione?  Se mi da una email le invio i miei riferimenti  Un saluto,  Riccardo Trubiani ritrubia@microsoft.com",ARCHIVE
2-YzUxMGYzOTQtNTg3Ny01MmE0LTgxNDAtZWQ5ZjRiZmZlY2RkXzAwMA==,,Davide Consiglio,https://www.linkedin.com/in/davideconsiglio,Riccardo Trubiani,https://www.linkedin.com/in/riccardotrubiani,2017-07-07 17:06:35 UTC,,"Buonasera dott Trubiani; grazie per il contatto e scusi il ritardo nella risposta. Mi manda cortesemente un CV a consiglio.davide@bcg.com? Grazie, un saluto, DC",ARCHIVE
2-YzUxMGYzOTQtNTg3Ny01MmE0LTgxNDAtZWQ5ZjRiZmZlY2RkXzAwMA==,,Riccardo Trubiani,https://www.linkedin.com/in/riccardotrubiani,Davide Consiglio,https://www.linkedin.com/in/davideconsiglio,2017-06-13 08:56:43 UTC,,"Buongiorno Dr. Consiglio,  sono Riccardo Trubiani e lavoro nella divisione Solution Sales in ambito Advanced Analytics di Microsoft. Il mio lavoro consiste nel disegnare soluzioni ad alto valore aggiunto per il business utilizzando tecniche avanzate di analisi dati, raggiungendo i target di vendita e di consumo cloud relativo ai data services. Per la parte di POC o implementativa, gestisco data scientist interni o ingaggio partner esterni, seguendone l'attività progettuale spesso sotto coinvestimento dalla mia azienda, a cui devo garantire un adeguato ROI.   Sarei interessato a capire meglio la realtà di BCG Gamma, crede sia possibile avere un momento di confronto, telefonico o di persona?  Grazie ed un saluto,  RT",ARCHIVE
2-OTFmYmZjNjctMjQ1My01YWFmLWExMzYtMThjNmM5YzZiZWUwXzAwMA==,,Simone Palamara,https://www.linkedin.com/in/simone-palamara-a3116326,Davide Consiglio,https://www.linkedin.com/in/davideconsiglio,2018-01-13 12:09:52 UTC,,"Buongiorno, grazie per la risposta, ho provveduto ad inviarle il CV alla email indicata.  Cordiali Saluti e buona giornata,  Simone Palamara",ARCHIVE
2-OTFmYmZjNjctMjQ1My01YWFmLWExMzYtMThjNmM5YzZiZWUwXzAwMA==,,Davide Consiglio,https://www.linkedin.com/in/davideconsiglio,Simone Palamara,https://www.linkedin.com/in/simone-palamara-a3116326,2018-01-13 11:19:56 UTC,,"Buongiorno dottore grazie del.messaggio, iniziamo a guardare il.cv con molto.piacere - mandi per favore a me Davide.consiglio@generali.com e lo carichi anche su generali.it sezione lavora con noi. Saluti DC",ARCHIVE
2-OTFmYmZjNjctMjQ1My01YWFmLWExMzYtMThjNmM5YzZiZWUwXzAwMA==,,Simone Palamara,https://www.linkedin.com/in/simone-palamara-a3116326,Davide Consiglio,https://www.linkedin.com/in/davideconsiglio,2017-12-28 09:27:29 UTC,,"Buongiorno Dott. Consiglio,  la ringrazio per avermi accettato come contatto Linkedin. Attualmente lavoro come Data scientist presso la società Moviri. Conosco due persone che lavorano nel suo team che hanno un percorso simile al mio (Dottorato in Ingegneria Matematica e esperienza nel campo Big data), per cui, se ci fossero possibilità di nuove assunzioni nel suo team, le chiederei gentilmente se potesse tenere in considerazione il mio profilo,  Cordiali Saluti,  Simone Palamara",ARCHIVE
2-MzhlNGUwNTQtOGY4OS01MmQzLWFlNmMtNzEyY2JmMTY1ZjM1XzAwMA==,,Amy Mitchell,,Davide Consiglio,https://www.linkedin.com/in/davideconsiglio,2018-01-11 15:41:20 UTC,,"Dear Davide,Noting your years of work experience and current role, I believe you might be an ideal candidate for our MS in Risk Management (MSRM) program at NYU Stern. If you&rsquo;re looking to take the next step forward in a career in risk management, follow the directions below to be considered for admission to the MSRM Class of 2019, beginning this May: Step 1: Submit your resume with the preliminary application form. The Admissions Office will contact you within one week of receipt. You may schedule an optional informational call as well. Step 2: Proceed directly with the online application. Step 3: Complete the online application, which includes a personal statement, resume, two recommendations, official transcripts, and GMAT/TOEFL (if required). Step 4: The Admissions Committee will contact you to schedule a final interview upon review of a completed application.Applications are being accepted for our next deadline of February 1. Get started and submit a preliminary application form today!Best, Amy Mitchell Assistant Director NYU Stern Global Executive Education",ARCHIVE
2-NzQxNWEwMzYtMjE1YS01MzhkLWEwNjAtY2QzOWQ0NDZmMzA4XzAwMA==,,Swathi Allada,https://www.linkedin.com/in/swathiallada,Davide Consiglio,https://www.linkedin.com/in/davideconsiglio,2018-01-11 07:01:04 UTC,,"Hello Davide,  Thanks for connecting!!  As a thought leader in the industry, we appreciate your valued opinion on the research study ""Global Digital Transformation Study"" that we at TRASERS are conducting. We would appreciate if you could give your valued inputs on the questions exclusively built for this study.   As an appreciation of your time, we will provide you an exclusive copy of the overall 2018 Global Digital Transformation report and offer you AMAZON COUPON worth USD $25 or pledge to the charity of equal amount.   I have shared the link @ davideconsiglio@icloud.com from reach@trasers.com, if you are willing to take part in this research study. Your credentials would be kept confidential.  Regards, Swathi",ARCHIVE
2-NzQxNWEwMzYtMjE1YS01MzhkLWEwNjAtY2QzOWQ0NDZmMzA4XzAwMA==,,Swathi Allada,https://www.linkedin.com/in/swathiallada,Davide Consiglio,https://www.linkedin.com/in/davideconsiglio,2018-01-11 07:00:05 UTC,,"Hello Cristina,  Thanks for connecting!!  As a thought leader in the industry, we appreciate your valued opinion on the research study ""Global Digital Transformation Study"" that we at TRASERS are conducting. We would appreciate if you could give your valued inputs on the questions exclusively built for this study.   As an appreciation of your time, we will provide you an exclusive copy of the overall 2018 Global Digital Transformation report and offer you AMAZON COUPON worth USD $25 or pledge to the charity of equal amount.   I have shared the link @ davideconsiglio@icloud.com from reach@trasers.com, if you are willing to take part in this research study. Your credentials would be kept confidential.  Regards, Swathi",ARCHIVE
2-NDFkMTQ0ODctYzE1My01MjcxLTgyOGYtNWZjZjYxZjJmNzQxXzAwMA==,,LinkedIn Marketing Solutions,,Davide Consiglio,https://www.linkedin.com/in/davideconsiglio,2018-01-08 06:46:51 UTC,,"Davide,With LinkedIn advertising you can engage with business leaders and decision makers, all in one place.If you would like to give LinkedIn advertising a try, click the button below to request your credits.With LinkedIn ads, you can:Reach over 500 million members based on job title, function, industry, and moreAttract new customers directly from the LinkedIn homepage and mobile feedMeasure results and optimize campaigns in the Campaign Manager toolSuccess awaits on the world&rsquo;s largest professional network.Sincerely,LinkedIn Marketing Solutions",ARCHIVE
2-NjkxMTFiZjUtNDllNS01MzcxLWJjZmQtMTlkNmU5MTZiYTYzXzAwMA==,,Cristiano Redona,https://www.linkedin.com/in/cristiano-redona-ai-by-design,Davide Consiglio,https://www.linkedin.com/in/davideconsiglio,2017-12-11 15:17:41 UTC,,"Ciao Davide, non ci conosciamo ma analizzando Generali Italia S.p.A. mi sono imbattuto nel tuo profilo, e vorrei aggiungerti alla mia rete.  Magari in futuro ci capiterà di collaborare. Grazie, C.",ARCHIVE
2-ZDliZDA3NDMtZjZjZC01ZTIxLTg0NzMtMzdiYWE5ZDEzNjBlXzAwMA==,,Antonella Pintus,https://www.linkedin.com/in/antonella-pintus-659a0489,Davide Consiglio,https://www.linkedin.com/in/davideconsiglio,2017-12-03 14:02:47 UTC,,"Sperando di fare cosa gradita le segnalo la Pagina www.linkedin.com/company-beta/15223167. La invito a seguire le attività di Crossnova, società di consulenza e formazione, che nasce dalla sinergia tra tecniche di Miglioramento Continuo e le più innovative tecnologie digitali. Distinti Saluti.",ARCHIVE
2-OTQ4ZjEwZmQtMjFmYi01Y2E0LWE5MmMtZGQ2NjZlMmUxM2NkXzAwMA==,,"Enrico Tonini, PhD",https://www.linkedin.com/in/enricotonini,Davide Consiglio,https://www.linkedin.com/in/davideconsiglio,2017-12-01 03:41:12 UTC,,"Ciao Davide,  Mi chiamo Enrico e sono un data scientist freelance. In questi 5 anni di lavoro post Dottorato ho avuto la fortuna di collaborare con diverse aziende di consulenza (Quantide, KPMG, BTO, PwC (con quest'ultima collaboro tuttora)) e di poter/aver potuto quindi lavorare per diversi clienti nel panorama italiano (Gruppo UniCredit, Sky, Tetra Pak, Luiss, Istat, ospedali, Fastweb, Gambro, Fresenius, università, etc.).  Ho dato un'occhiata al tuo profilo LinkedIn negli ultimi giorni e ho visto che vieni da una lunga esperienza con BCG. Un mio ex collega in PwC tra l'altro, uno dei ragazzi con cui ho lavorato meglio in assoluto in questi primi 5 anni da consulente statistico, ora lavora in BCG.  Venendo al sodo, ho saputo che ora lavori in Generali e che stai creando un gruppo analitico di un certo livello, di cui conosco (ci ho lavorato assieme per quasi un anno) già almeno un componente. Bene, non ti nascondo che sono molto interessato a seguire gli sviluppi della cosa. Mi farebbe quindi molto piacere e sarebbe un onore conoscerti per capire se nel breve o medio termine abbiamo dei margini di collaborazione.  Se ti interessa e puoi dedicarmi un po' del tuo tempo, intanto ti lascio i miei contatti: - cell.: +39 348 0576492; - ‎email: enrico.tonini.stat@gmail.com  Buona giornata e, spero, a presto.  Ciao, Enrico",ARCHIVE
2-YzUxZGJkYWQtYzQ2MS01NzRmLTk1ZWEtNTUyYmUyM2FhMWJiXzAwMA==,,Filippo Neri,https://www.linkedin.com/in/filipponeri,Davide Consiglio,https://www.linkedin.com/in/davideconsiglio,2017-11-28 13:50:43 UTC,"Infor In pole position con Bi&Analytics | Circuito di Fiorano, 13 Dicembre | INVITO PERSONALE","Gentile Davide, spero di fare cosa gradita invitandola all’evento BIRST, la nuova soluzione di BI&Analytics di INFOR.  http://www.iconsulting.biz/2017/11/infor-birst-pole-position-bianalytics/#iscrizione  All'indirizzo sopra trova agenda, logistica e modalità di iscrizione. L’evento esclusivo è a numero chiuso, pertanto si senta libero di estendere eventualmente l’invito a non più di un collega interessato ed a provvedere alla registrazione al più presto per riservare i posti in sala. Con i migliori saluti,   Filippo Neri | Sales Account Manager Infor Italia | Via Torri Bianche 24 | 20871 Vimercate (MB)  +39 348 5619 539 | filippo.neri@infor.com",ARCHIVE
2-ZGM1OGFlNzgtYmY2Zi01OWM4LTk2NDctYjc5NDQ0N2QyMmY2XzAwMA==,,Andrea Gigli,https://www.linkedin.com/in/agigli,Davide Consiglio,https://www.linkedin.com/in/davideconsiglio,2017-11-23 13:59:57 UTC,,"Ciao Davide, si volentieri. A dopo! Andrea",ARCHIVE
2-ZGM1OGFlNzgtYmY2Zi01OWM4LTk2NDctYjc5NDQ0N2QyMmY2XzAwMA==,,Davide Consiglio,https://www.linkedin.com/in/davideconsiglio,Andrea Gigli,https://www.linkedin.com/in/agigli,2017-11-23 13:39:35 UTC,,Andrea scusa il ritardo - stasera dopo le 1930? Spero ancora utile   335 8373104,ARCHIVE
2-ZGM1OGFlNzgtYmY2Zi01OWM4LTk2NDctYjc5NDQ0N2QyMmY2XzAwMA==,,Andrea Gigli,https://www.linkedin.com/in/agigli,Davide Consiglio,https://www.linkedin.com/in/davideconsiglio,2017-11-14 18:47:45 UTC,,Ciao Davide grazie per il collegamento :) Non so se ti ricordi ci siamo sentiti quando lavoravi in Bcg  per una posizione su Milano nel team Gamma. Era luglio mi pare. Ho superato tutti gli step di selezione mi piacerebbe fare due chiacchiere se puoi. Quando vuoi tu :) Grazie mille Andrea Gigli,ARCHIVE
2-ZDZmODkzZTItNTQwZS01YmZlLTgzOTctMGQ4NjA0MjY5YmE0XzAwMA==,,Laura Piva,https://www.linkedin.com/in/laura-piva-694206121,Davide Consiglio,https://www.linkedin.com/in/davideconsiglio,2017-11-23 14:40:44 UTC,,benvenuto!,ARCHIVE
2-YTAyNWE4OTUtNjNlYi01NmZjLWJkYjctMmYxMDgwYzkxOWRiXzAwMA==,,Alessio  Montaruli,https://www.linkedin.com/in/alessiomontaruli,Davide Consiglio,https://www.linkedin.com/in/davideconsiglio,2017-11-17 14:39:23 UTC,,"Grazie  a lei per il contatto. Visionerei con interesse un Suo CV in modo dapoterla ricontattare per posizioni aperte in linea con il Suo profilo. Se volesse girarmelo via mail, il mio indirizzo è alessio.m@tapartners.org.  Grazie e buon weekend! Alessio Montaruli",ARCHIVE
2-YTAyNWE4OTUtNjNlYi01NmZjLWJkYjctMmYxMDgwYzkxOWRiXzAwMA==,,Davide Consiglio,https://www.linkedin.com/in/davideconsiglio,Alessio  Montaruli,https://www.linkedin.com/in/alessiomontaruli,2017-11-16 19:24:26 UTC,,Con piacere Grazie saluti DC,ARCHIVE
2-YTAyNWE4OTUtNjNlYi01NmZjLWJkYjctMmYxMDgwYzkxOWRiXzAwMA==,,Alessio  Montaruli,https://www.linkedin.com/in/alessiomontaruli,Davide Consiglio,https://www.linkedin.com/in/davideconsiglio,2017-11-16 19:23:30 UTC,,"Gentile Davide  sono direttore italiano di una società di executive search specializzata in ambito machine learning e analytics. Avremmo piacere di invitarla ad entrare nei nostri contatti.  Cordialmente,  Alessio Montaruli www.tapartners.org ",ARCHIVE
2-OGM3Y2Q4YTEtNWM1MS01OTkzLTg3OTYtZmJhMDVlYzcyMGNiXzAwMA==,,Cosimo Accoto,https://www.linkedin.com/in/cosimoaccoto,Davide Consiglio,https://www.linkedin.com/in/davideconsiglio,2017-11-14 19:33:12 UTC,,"Certo, grazie :-)",ARCHIVE
2-OGM3Y2Q4YTEtNWM1MS01OTkzLTg3OTYtZmJhMDVlYzcyMGNiXzAwMA==,,Davide Consiglio,https://www.linkedin.com/in/davideconsiglio,Cosimo Accoto,https://www.linkedin.com/in/cosimoaccoto,2017-11-14 19:29:14 UTC,,"Ciao Cosimo, scusa sono dovuto scappare, piacere di averti conosciuto e mi raccomando se passi in centro a Milano non esitare a farmi sapere prendiamo un caffè e ti faccio conoscere il team - a presto! Davide",ARCHIVE
