CONVERSATION ID,CONVERSATION TITLE,FROM,SENDER PROFILE URL,TO,RECIPIENT PROFILE URLS,DATE,SUBJECT,CONTENT,FOLDER
2-OWQ5ZWRmMmItM2M2My01M2M4LWE0MjItOWU0YTZhZWUyM2EwXzAxMw==,,Irfan Rahman,https://www.linkedin.com/in/irfan-rahman-b09a7643,Davide Consiglio,https://www.linkedin.com/in/davideconsiglio,2019-03-27 13:33:05 UTC,,Hi Davide   I run a marketplace for freelance consultants / data scientists - now 1000+ members (120+ ex-BCG). I saw an update on LinkedIn through a mutual contact. I've partnered with an ex-BCG/Head of Amazon UK pricing data scientist (he helps build our DS community).   Is it worth connecting you?,ARCHIVE
2-ODM2YTJiZTctZTZmNy01NjkzLWJkODMtNWI4NjE5ODMxYmY1XzAxMw==,,Julian Brophy,https://www.linkedin.com/in/hellojb,Davide Consiglio,https://www.linkedin.com/in/davideconsiglio,2019-03-26 15:58:32 UTC,,"Buongiorno Sig. Consiglio,  Sono il vostro Slack account manager. Sarebbe un piacere connettere su Linkedin, ed aiutarvi con Slack in futuro.  Saluti, Julian ",ARCHIVE
2-ZjYxNzI3MDEtZTRiZi01MWZhLWJmYzAtMTAwODhkYTBmNTg2XzAwMA==,,Paweł Godula,https://www.linkedin.com/in/pawelgodula,Davide Consiglio,https://www.linkedin.com/in/davideconsiglio,2019-03-26 11:06:40 UTC,,"Hey Davide, how are you! I just realized i read your message a long time ago and forgot to reply. So sorry for this. I am currently at Deepsense and we do cool stuff. Also for insurers in Poland :)  How is life at Generali?  Regarding your idea: lets discuss. Is there any chance that this would be commercial opportunity for us? I am asking because my CEO will ask me the same if I want to send people there :)  All the best my Friend! Pawel",ARCHIVE
2-ZjYxNzI3MDEtZTRiZi01MWZhLWJmYzAtMTAwODhkYTBmNTg2XzAwMA==,,Davide Consiglio,https://www.linkedin.com/in/davideconsiglio,Paweł Godula,https://www.linkedin.com/in/pawelgodula,2018-11-29 22:00:02 UTC,,"Hey Pawel, how are you my friend?   Listen, I was thinking something: why don't we plan in q1 next year a ""2 days data science exchange"" of some of your folks to come and meet my team in Milan and viceversa? It could be great motivation for scientists, share ideas etc, in a non competitive environment.   Let me know! All the best D",ARCHIVE
2-ZjYxNzI3MDEtZTRiZi01MWZhLWJmYzAtMTAwODhkYTBmNTg2XzAwMA==,,Paweł Godula,https://www.linkedin.com/in/pawelgodula,Davide Consiglio,https://www.linkedin.com/in/davideconsiglio,2018-09-17 06:51:49 UTC,,here is the link :),ARCHIVE
2-ZjYxNzI3MDEtZTRiZi01MWZhLWJmYzAtMTAwODhkYTBmNTg2XzAwMA==,,Paweł Godula,https://www.linkedin.com/in/pawelgodula,Davide Consiglio,https://www.linkedin.com/in/davideconsiglio,2018-09-17 06:51:45 UTC,,https://deepsense.ai/wait-so-loans-need-to-be-repaid-the-home-credit-risk-prediction-competition-on-kaggle/,ARCHIVE
2-ZjYxNzI3MDEtZTRiZi01MWZhLWJmYzAtMTAwODhkYTBmNTg2XzAwMA==,,Davide Consiglio,https://www.linkedin.com/in/davideconsiglio,Paweł Godula,https://www.linkedin.com/in/pawelgodula,2018-09-15 07:06:52 UTC,,"Wow congrats!! Looks exciting, keep me posted on your article. Talk soon, all the best, D",ARCHIVE
2-NGI3NzQ3MDMtMTRjMi01Njk5LTlkMTctMjYwZTU1MTZhYThiXzAxMw==,,Comarch Financial Services,,Davide Consiglio,https://www.linkedin.com/in/davideconsiglio,2019-03-16 18:52:46 UTC,,"Dear DavideInsurance is facing incredibly interesting times. No single insurer now gives up on looking for ways to collect, analyze and use data more effectively. Digitization becomes everyday corporate mantra.But the process itself is not a walk in the park.We know so because we've been in the financial IT business for 25 years now. With a few clear goals in mind, one of them being: to simplify the way people take out insurance policies.Today, we believe we have a solution. An omnichannel, front-office system dedicated, on one hand, to agents, brokers or bank partners that helps them advise on and sell insurance products. A tool allowing individual insurance customers to smoothly purchase a policy online – on the other.It's called Comarch Digital Insurance. It's the proof you don't need to spill that much sweat and tears over the transformation to the bits-and-bytes era.Join us for a short presentation to find out for yourself. Don’t navigate the transformative wave alone, you have your clients back, we’ll have yours.",ARCHIVE
2-MGI1YzVlMzktMWU0OS01OTY5LTg4YTctMzU2YmQ1Yjk5NzdkXzAxMw==,,Davide Consiglio,https://www.linkedin.com/in/davideconsiglio,Sepehr Beheshti,https://www.linkedin.com/in/sepehr-beheshti,2019-03-12 10:15:39 UTC,,Saluti DC,ARCHIVE
2-MGI1YzVlMzktMWU0OS01OTY5LTg4YTctMzU2YmQ1Yjk5NzdkXzAxMw==,,Davide Consiglio,https://www.linkedin.com/in/davideconsiglio,Sepehr Beheshti,https://www.linkedin.com/in/sepehr-beheshti,2019-03-12 10:15:32 UTC,,Grazie Sepehr mandami il cv a Davide.consiglio@generali.com e lo inoltro a HR per inserire in pipeline,ARCHIVE
2-MGI1YzVlMzktMWU0OS01OTY5LTg4YTctMzU2YmQ1Yjk5NzdkXzAxMw==,,Sepehr Beheshti,https://www.linkedin.com/in/sepehr-beheshti,Davide Consiglio,https://www.linkedin.com/in/davideconsiglio,2019-03-12 07:17:04 UTC,,"Buongiorno Davide,  sono Sepehr, ieri sera ci siamo visti all’evento in Generali e abbiamo parlato all’aperitivo. Come dicevo, sto lavorando in L’Orèal come consulente e sono molto molto interessato al mondo di ML e data science e mi piacerebbe tantissimo lavorare in un team di analytics. Come concordato, le scrivo per chiedere gentilmente la persona a cui posso presentare la mia autocandidatura,  Grazie mille e buona giornata, Sepehr",ARCHIVE
2-ZWEzZTBkZGQtOGFiMy01NDUyLTk1N2YtZWI2ZTMwNTcyMWFiXzAxMg==,,Siobhan Waters ,,Davide Consiglio,https://www.linkedin.com/in/davideconsiglio,2019-03-05 12:02:53 UTC,,"Hi Davide,Did you know that customers who use LinkedIn Sales Navigator see 35%+ larger deal sizes?LinkedIn Sales Navigator helps sales teams sell smarter. By leveraging our proprietary platform, sales teams can better prospect and engage with the right people, delivering quality pipeline for sales to move forward efficiently and effectively.Take the next step and watch the demo on how Sales Navigator can help you.Warm Regards,Siobhan WatersLinkedIn Sales Solutions",ARCHIVE
2-MmZjOTBiNDQtZjJmYS01NDczLTk0MmMtODc3NmM4NzkwMTgzXzAxMw==,,LinkedIn Member,,Davide Consiglio,https://www.linkedin.com/in/davideconsiglio,2019-03-03 20:03:39 UTC,,"Buonasera Dott. Consiglio, vorrei proporle la realizzazione del modello di innovazione basato su startup corporate in allegato. Sono un professore universitario esperto di intelligenza artificiale. Dalle mie esperienze in aziende italiane ed estere mi sono reso conto che sviluppare progetti di innovazione in house e' meno favorevole che svilupparli tramite la creazione di una startup apposita basata negli USA. Vorrei proporle quindi di sviluppare uno dei vostri progetti innovativi secondo lo schema accluso che produrrebbe prospettive economiche interessanti per tutti gli stakeholders. Qualora fosse interessato ad un colloquio telefonico conoscitivo sono disponibile. La ringrazio per l'attenzione. Cordiali saluti, Filippo Neri",ARCHIVE
2-YjY4NThhYWUtZWZhOC01OTE0LThjNzEtMTZmYmQzZjE0Mzk5XzAxMw==,,Giulio Momentè,https://www.linkedin.com/in/giulio-momente,Davide Consiglio,https://www.linkedin.com/in/davideconsiglio,2019-02-27 20:32:42 UTC,,"I heard you are going to expand your data analytics team.   If you'll find my cv interesting, I'll love to hear more on the openings.    Thanks in advance for your time,    Kindest regards,  Giulio Momente'",ARCHIVE
2-YjY4NThhYWUtZWZhOC01OTE0LThjNzEtMTZmYmQzZjE0Mzk5XzAxMw==,,Giulio Momentè,https://www.linkedin.com/in/giulio-momente,Davide Consiglio,https://www.linkedin.com/in/davideconsiglio,2019-02-27 20:30:08 UTC,,"Dear Mr. Consiglio,",ARCHIVE
2-YjY4NThhYWUtZWZhOC01OTE0LThjNzEtMTZmYmQzZjE0Mzk5XzAxMw==,,Giulio Momentè,https://www.linkedin.com/in/giulio-momente,Davide Consiglio,https://www.linkedin.com/in/davideconsiglio,2019-02-24 15:24:52 UTC,,"Dear Mr. Consiglio,   pardon my boldness but I'd love to reach out since you are interested in analytics figures for your team.   Kindest regards,   Giulio Momentè",ARCHIVE
2-Yjk1M2U5ZTItOTQ1Yi01MjkwLThlZGItZTg4MGZkOTUxMjAyXzAxMA==,,Stefano Cruciani,https://www.linkedin.com/in/stefanocruciani,Davide Consiglio,https://www.linkedin.com/in/davideconsiglio,2019-02-21 15:29:26 UTC,Denodo - richiesta incontro,"Buonasera dott. Consiglio,  Ho provato a contattarla in varie occasioni durante queste settimane via email (dal titolo ""Denodo Italia - proposta incontro"") e via telefono, ma purtroppo non sono riuscita a raggiungerLa.  La sto cercando in quanto mi piacerebbe di come la Data Virtualization stia entrando nel vostro roadmap futuro o del prossimo anno per migliorare l'agilitá e la flessibilitá della vostra struttura nell'area di analitica avanzata di Generali.  Da quest'anno Denodo ha aperto ufficialmente la sua struttura anche in Italia e stiamo lavorando con leader a livello mondiale nel settore industriale, con i quali abbiamo intrapreso un percorso strategico all’interno delle loro architetture, dove la Virtualizzazione dei Dati di Denodo può apportare un valore significativo nella flessibilità, agilità, tempestività e sicurezza nel reperire le informazioni.  Mi farebbe piacere sentirci per un primo scambio di idee, ed eventualmente poi poter organizzare un incontro di approfondimento. Avrebbe disponibilitá durante le prossime settimane?  Le conddivido informazioni piú dettagliate: https://www.denodo.com/en/document/whitepaper/data-virtualization-modern-data-integration-solution  Grazie, a presto.  Stefano   Stefano Cruciani Denodo - The Data Virtualization Company Business Development Iberia, Italy & LATAM P: (+34) 912 77 58 55 E: scruciani@denodo.com",ARCHIVE
2-MTM4MDczYTAtYTZjMS01YzMyLTljY2UtZjczZjJmNzY2NTJkXzAxMw==,,Davide Consiglio,https://www.linkedin.com/in/davideconsiglio,"Simona Boffelli, PhD, CFA",https://www.linkedin.com/in/simona-boffelli,2019-02-19 07:15:08 UTC,,"A presto, D",ARCHIVE
2-MTM4MDczYTAtYTZjMS01YzMyLTljY2UtZjczZjJmNzY2NTJkXzAxMw==,,Davide Consiglio,https://www.linkedin.com/in/davideconsiglio,"Simona Boffelli, PhD, CFA",https://www.linkedin.com/in/simona-boffelli,2019-02-19 07:14:59 UTC,,"Qui ci difendiamo, i Chief per ora sono contenti non disturbo il cane che dorme... ;-)",ARCHIVE
2-MTM4MDczYTAtYTZjMS01YzMyLTljY2UtZjczZjJmNzY2NTJkXzAxMw==,,Davide Consiglio,https://www.linkedin.com/in/davideconsiglio,"Simona Boffelli, PhD, CFA",https://www.linkedin.com/in/simona-boffelli,2019-02-19 07:14:26 UTC,,Bene bene! Mandami l'ISIN voglio metterlo tra i favoriti... :),ARCHIVE
2-MTM4MDczYTAtYTZjMS01YzMyLTljY2UtZjczZjJmNzY2NTJkXzAxMw==,,"Simona Boffelli, PhD, CFA",https://www.linkedin.com/in/simona-boffelli,Davide Consiglio,https://www.linkedin.com/in/davideconsiglio,2019-02-16 12:43:00 UTC,,"Ciao Davide! Bene, direi che per ora va bene, sono tornata ad occuparmi di soldi finti e quindi mi sento più al mio posto. Tu, hai ormai domato il leone con gli AA?",ARCHIVE
2-MTM4MDczYTAtYTZjMS01YzMyLTljY2UtZjczZjJmNzY2NTJkXzAxMw==,,Davide Consiglio,https://www.linkedin.com/in/davideconsiglio,"Simona Boffelli, PhD, CFA",https://www.linkedin.com/in/simona-boffelli,2019-02-16 09:09:11 UTC,,Delinquente come te la passi!?!?,ARCHIVE
2-Y2UxNmRlM2UtYWFlNS01NjI2LWJkNGYtYTkyNTJmNDcwYTdmXzAxMg==,,Zein M. H.,https://www.linkedin.com/in/zhawwari,Davide Consiglio,https://www.linkedin.com/in/davideconsiglio,2019-02-18 05:30:32 UTC,Job Opportunity with Majid Al Futtaim Holding,"Hi Davide,   I hope this finds you well.  My name is Zein Hawwari, and I am part of the Talent Acquisition team at Majid Al Futtaim Holding. Majid Al Futtaim is the leading shopping mall, retail, communities, and leisure developer and operator in the Middle East, North Africa and Central Asia regions. With over 42,500 people, US$ 9 Billion in revenues, operations in 15 countries, Majid Al Futtaim is one of the most admired private companies in the world.  We are currently looking for a Head of Advanced Analytics to lead our growing Advanced Analytics team here in Dubai. The role is strictly confidential and will be discussed further by phone.   If you are interested to know more, please do send me your updated resume including your contact details at zein.hawwari@maf.ae to discuss further.  Best Regards, Zein   Zein Hawari Talent Acquisition Specialist, Human Capital at Majid Al Futtaim Holding",ARCHIVE
2-MTI0MmE1YjQtZTQ4ZS01ZjA2LWI2MzItOTRjNDQzOWM4N2ZjXzAwMA==,,Domenico Martelli,https://www.linkedin.com/in/domenicomartelli,Davide Consiglio,https://www.linkedin.com/in/davideconsiglio,2019-02-12 15:19:09 UTC,,ok grazie e a presto!!,ARCHIVE
2-MTI0MmE1YjQtZTQ4ZS01ZjA2LWI2MzItOTRjNDQzOWM4N2ZjXzAwMA==,,Davide Consiglio,https://www.linkedin.com/in/davideconsiglio,Domenico Martelli,https://www.linkedin.com/in/domenicomartelli,2019-02-12 15:06:18 UTC,,"Ciao Domenico, sono abbastanza buzzwords!!! Non esitare a farmi mandare il cv a davide.consiglio@generali.com lo guardo molto volentieri e faccio una chiacchierata A presto! D",ARCHIVE
2-MTI0MmE1YjQtZTQ4ZS01ZjA2LWI2MzItOTRjNDQzOWM4N2ZjXzAwMA==,,Domenico Martelli,https://www.linkedin.com/in/domenicomartelli,Davide Consiglio,https://www.linkedin.com/in/davideconsiglio,2019-02-12 14:00:58 UTC,,"o almeno, queste sono le buzzwords con cui mi tormenta 😀",ARCHIVE
2-MTI0MmE1YjQtZTQ4ZS01ZjA2LWI2MzItOTRjNDQzOWM4N2ZjXzAwMA==,,Domenico Martelli,https://www.linkedin.com/in/domenicomartelli,Davide Consiglio,https://www.linkedin.com/in/davideconsiglio,2019-02-12 14:00:35 UTC,,"nel tempo si è occupata di business intelligence, data warehouse, enterprise data hub e applicazioni di reporting, business process and consolidation, big data lake, AI, applicati ai processi di business e finance",ARCHIVE
2-MTI0MmE1YjQtZTQ4ZS01ZjA2LWI2MzItOTRjNDQzOWM4N2ZjXzAwMA==,,Domenico Martelli,https://www.linkedin.com/in/domenicomartelli,Davide Consiglio,https://www.linkedin.com/in/davideconsiglio,2019-02-12 13:54:54 UTC,,"Ciao Davide, ho visto la tua ricerca. Mia moglie fa la business/data scientist da 15 anni nella funzione di Data Platform di Fastweb. Abbastanza per cambiare ... Può interessarti un contatto?",ARCHIVE
2-MGZkOTUyNGMtNzBjMi01NTliLWIxZWUtZTBkYzIzMzFmNWY1XzAxMw==,,Bruno Scaroni,https://www.linkedin.com/in/bruno-scaroni,Davide Consiglio,https://www.linkedin.com/in/davideconsiglio,2019-02-12 15:11:58 UTC,,Quando vuoi benvenuto in AG!,ARCHIVE
2-MGZkOTUyNGMtNzBjMi01NTliLWIxZWUtZTBkYzIzMzFmNWY1XzAxMw==,,Davide Consiglio,https://www.linkedin.com/in/davideconsiglio,Bruno Scaroni,https://www.linkedin.com/in/bruno-scaroni,2019-02-12 15:08:12 UTC,,"Ciao Bruno, grazie per il collegamento! Mi ero ripromesso ma non sono riuscito a intercettarti l'altro giorno a Mogliano e neanche ti avevo ancora scritto per prendere un caffè, shame on me. Dobbiamo assolutamente vederci quando siamo entrambi in torre prossimamente, un caro saluto intanto, D",ARCHIVE
2-NDQyZGVlOGEtODNlMi01YzVmLWE0YWEtYTc0MmY5ZTUzNDQ0XzAxMQ==,,"Trishanan Das, A-CSPO",https://www.linkedin.com/in/trishanan,Davide Consiglio,https://www.linkedin.com/in/davideconsiglio,2019-02-12 10:03:13 UTC,,"Thanks for reaching out sir. I believe that it will be an opportunity of lifetime to work for generali Italy. I will learn a lot. If I get an opportunity, I can learn Italian language and get fluent at it. Thank you",ARCHIVE
2-NDQyZGVlOGEtODNlMi01YzVmLWE0YWEtYTc0MmY5ZTUzNDQ0XzAxMQ==,,Davide Consiglio,https://www.linkedin.com/in/davideconsiglio,"Trishanan Das, A-CSPO",https://www.linkedin.com/in/trishanan,2019-02-11 21:04:47 UTC,,"Hi Trishanan, thanks to you; truth be told, my openings require fluency in Italian, but pls do check out our website  All the best Davide",ARCHIVE
2-NDQyZGVlOGEtODNlMi01YzVmLWE0YWEtYTc0MmY5ZTUzNDQ0XzAxMQ==,,"Trishanan Das, A-CSPO",https://www.linkedin.com/in/trishanan,Davide Consiglio,https://www.linkedin.com/in/davideconsiglio,2019-02-09 13:32:14 UTC,,Sir i recently saw openings at generali Italy. Are the positions open for immigrants? ,ARCHIVE
2-NDQyZGVlOGEtODNlMi01YzVmLWE0YWEtYTc0MmY5ZTUzNDQ0XzAxMQ==,,"Trishanan Das, A-CSPO",https://www.linkedin.com/in/trishanan,Davide Consiglio,https://www.linkedin.com/in/davideconsiglio,2019-02-09 13:28:11 UTC,,"Hello sir, thanxx a lot for connecting! ",ARCHIVE
2-YTNiZTAxNDMtMTE3NS01ZGQzLTgwOTktZTYyZjZjNGY4Y2FmXzAxMA==,,Sanchita kumari,https://www.linkedin.com/in/sanchita-kumari-47243571,Davide Consiglio,https://www.linkedin.com/in/davideconsiglio,2019-02-12 09:09:33 UTC,,"Thank you Mr Davide for your reply.  I mailed Mr Massimo my CV and also about my conversation with you and Mr.Jens.  Thanks & Regards, Sanchita",ARCHIVE
2-YTNiZTAxNDMtMTE3NS01ZGQzLTgwOTktZTYyZjZjNGY4Y2FmXzAxMA==,,Davide Consiglio,https://www.linkedin.com/in/davideconsiglio,Sanchita kumari,https://www.linkedin.com/in/sanchita-kumari-47243571,2019-02-11 21:00:21 UTC,,"Dear Sanchita, thanks much for reaching out; pls send your cv to Massimo.natale@generali.com referring to our conversation and the introduction from Jens   Best regards Davide",ARCHIVE
2-YTNiZTAxNDMtMTE3NS01ZGQzLTgwOTktZTYyZjZjNGY4Y2FmXzAxMA==,,Sanchita kumari,https://www.linkedin.com/in/sanchita-kumari-47243571,Davide Consiglio,https://www.linkedin.com/in/davideconsiglio,2019-02-09 20:12:09 UTC,,https://www.linkedin.com/feed/update/urn:li:activity:6499782662109032448,ARCHIVE
2-YTNiZTAxNDMtMTE3NS01ZGQzLTgwOTktZTYyZjZjNGY4Y2FmXzAxMA==,,Sanchita kumari,https://www.linkedin.com/in/sanchita-kumari-47243571,Davide Consiglio,https://www.linkedin.com/in/davideconsiglio,2019-02-09 20:11:30 UTC,,"Hello Mr. Davide,  I got your reference from Mr Jens Ortmann regarding your post on Linkedin for Data Science opportunity at Generali.  I am writing to you as I am interested in this opportunity and willing to speak with you in detail. At present I am working in a Consulting firm in Bologna and willing to relocate to Milan.  Looking forward to speak with you in more details.  Kind Regards, Sanchita",ARCHIVE
2-NWUyZDhiZTAtMjIxMS01MmNlLWJjMjUtNGE2M2RhZmUyZGU1XzAxMw==,,Talha Ijaz,https://www.linkedin.com/in/talha-ijaz-0b135813a,Davide Consiglio,https://www.linkedin.com/in/davideconsiglio,2019-02-11 21:17:41 UTC,,"Alright, thank you. Have a nice day.",ARCHIVE
2-NWUyZDhiZTAtMjIxMS01MmNlLWJjMjUtNGE2M2RhZmUyZGU1XzAxMw==,,Davide Consiglio,https://www.linkedin.com/in/davideconsiglio,Talha Ijaz,https://www.linkedin.com/in/talha-ijaz-0b135813a,2019-02-11 20:54:19 UTC,,"Hi Talha, thanks much for reaching out; I haven't made a plan for summer interns yet but pls do apply on the generali.it website and ping me in 3 months or so  Best D",ARCHIVE
2-NWUyZDhiZTAtMjIxMS01MmNlLWJjMjUtNGE2M2RhZmUyZGU1XzAxMw==,,Talha Ijaz,https://www.linkedin.com/in/talha-ijaz-0b135813a,Davide Consiglio,https://www.linkedin.com/in/davideconsiglio,2019-02-11 13:55:38 UTC,,Respected;  Hope you are doing fine. I recently saw your post on LinkedIn. I was wondering if your department plans on taking any data science interns this summer. I am sending you my updated CV for reference. Thank you.  Regards Talha Ijaz,ARCHIVE
2-NWUyZDhiZTAtMjIxMS01MmNlLWJjMjUtNGE2M2RhZmUyZGU1XzAxMw==,,Talha Ijaz,https://www.linkedin.com/in/talha-ijaz-0b135813a,Davide Consiglio,https://www.linkedin.com/in/davideconsiglio,2018-11-20 13:25:29 UTC,,Thank you so much sir. I really appreciate that. Have a nice day.,ARCHIVE
2-NWUyZDhiZTAtMjIxMS01MmNlLWJjMjUtNGE2M2RhZmUyZGU1XzAxMw==,,Davide Consiglio,https://www.linkedin.com/in/davideconsiglio,Talha Ijaz,https://www.linkedin.com/in/talha-ijaz-0b135813a,2018-11-20 09:01:48 UTC,,"Hi Muhammad, thanks much for reaching out; sure thing, I'll forward your CV to my HR and we'll potentially get back soon. All the best Davide",ARCHIVE
2-ZWQzZjE1MTItMGVhNy01N2U5LWFiZTQtNDk2NThhMjljNzIyXzAwMA==,,Emanuele Haerens,https://www.linkedin.com/in/emanuele-haerens-5350a3a1,Davide Consiglio,https://www.linkedin.com/in/davideconsiglio,2019-02-11 09:12:24 UTC,,"Hi Davide, I saw that you're doubling your AI capabilities and looking to hire talented scientists and engineers - that's great news!  We can help, have you heard of our Fellowship Programme? https://faculty.ai/products-services/fellowship/ It's EU best talent pipeline for Data Scientists/Engineers for companies looking to hire great talent in this space.   Perhaps you might reach me by email to organise a followup chat?  emanuele@faculty.ai",ARCHIVE
2-ZWQzZjE1MTItMGVhNy01N2U5LWFiZTQtNDk2NThhMjljNzIyXzAwMA==,,Emanuele Haerens,https://www.linkedin.com/in/emanuele-haerens-5350a3a1,Davide Consiglio,https://www.linkedin.com/in/davideconsiglio,2018-01-19 09:53:42 UTC,,"Ciao Davide,   E' libero settimana prossima per una chiaccherata?  Se mi fa sapere il giorno/ora che le va meglio mi organizzo di conseguenza.   Grazie, Emanuele",ARCHIVE
2-ZWQzZjE1MTItMGVhNy01N2U5LWFiZTQtNDk2NThhMjljNzIyXzAwMA==,,Emanuele Haerens,https://www.linkedin.com/in/emanuele-haerens-5350a3a1,Davide Consiglio,https://www.linkedin.com/in/davideconsiglio,2018-01-03 16:00:34 UTC,,"Hi Davide,   Thank you for connecting.  I'd love to learn more about AI and Data Science at Generali - perhaps we could jump on a quick call in the next couple of weeks?  Best, Emanuele",ARCHIVE
2-ZWQzZjE1MTItMGVhNy01N2U5LWFiZTQtNDk2NThhMjljNzIyXzAwMA==,,Emanuele Haerens,https://www.linkedin.com/in/emanuele-haerens-5350a3a1,Davide Consiglio,https://www.linkedin.com/in/davideconsiglio,2018-01-03 15:46:28 UTC,,"Ciao Davide,  Happy New Year!  SherlockML is a leading platform for Data Scientists. We solve problems around collaboration, provisioning infrastructure and tools, and productionising models. I'd love to hear about your Data Science programme.  Best, Emanuele",ARCHIVE
2-Y2ZhODIyY2EtZDI3Mi01MzY5LWJhYjktZTY1YTVkYTEwYWJjXzAxMw==,,Davide Consiglio,https://www.linkedin.com/in/davideconsiglio,Antonio Faraldi,https://www.linkedin.com/in/antonio-faraldi,2019-02-09 10:27:09 UTC,,"Scusa: ho realizzato secoli dopo che mi avevi scritto, oggi dopo le 4 se puoi ci possiamo sentire..",ARCHIVE
2-Y2ZhODIyY2EtZDI3Mi01MzY5LWJhYjktZTY1YTVkYTEwYWJjXzAxMw==,,Davide Consiglio,https://www.linkedin.com/in/davideconsiglio,Antonio Faraldi,https://www.linkedin.com/in/antonio-faraldi,2019-02-09 10:26:34 UTC,,Ma sull'interpersonal sono soft?!?,ARCHIVE
2-Y2ZhODIyY2EtZDI3Mi01MzY5LWJhYjktZTY1YTVkYTEwYWJjXzAxMw==,,Davide Consiglio,https://www.linkedin.com/in/davideconsiglio,Antonio Faraldi,https://www.linkedin.com/in/antonio-faraldi,2019-02-09 10:26:18 UTC,,Ma dici che con 15K di entry bonus me la cavo?,ARCHIVE
2-Y2ZhODIyY2EtZDI3Mi01MzY5LWJhYjktZTY1YTVkYTEwYWJjXzAxMw==,,Davide Consiglio,https://www.linkedin.com/in/davideconsiglio,Antonio Faraldi,https://www.linkedin.com/in/antonio-faraldi,2019-02-09 10:25:59 UTC,,Scemo!,ARCHIVE
2-Y2ZhODIyY2EtZDI3Mi01MzY5LWJhYjktZTY1YTVkYTEwYWJjXzAxMw==,,Antonio Faraldi,https://www.linkedin.com/in/antonio-faraldi,Davide Consiglio,https://www.linkedin.com/in/davideconsiglio,2019-02-09 09:56:43 UTC,,"Visto il post. Io due forti li conosco. Un po’ senior, ma secondo me da te ci vengono. Forse li conosci tra l’altro. Uno e’ Francese, Sylvain, e l’altro olandese, Marc. Se ti piccioni forti sugli aspetti tecnici e sei disposto a chiudere un occhio sul fatto che sono un po’ timidini e introversi, sono perfetti! Se vuoi in contatto scrivimi, happy to :)",ARCHIVE
2-ZDg5MmEyNjUtNTUwMy01ODcyLWI3OGUtMGYwYjczOWE2NjRiXzAxMw==,,Arianna A.,https://www.linkedin.com/in/arianna-a-083b9043,Davide Consiglio,https://www.linkedin.com/in/davideconsiglio,2019-02-07 12:58:36 UTC,,"Buongiorno, sono una Executive Relationship Manager di Sherpany, società leader europea che offre una soluzione per la gestione delle riunioni esecutive e consiliari.  Mi piacerebbe aggiungerla alla mia rete.  Cordiali Saluti",ARCHIVE
2-Njk0YmQ0MWEtYjJkMy01MjVhLWEyZGEtNjQxOGQzYTQzMzFhXzAxMw==,,Anna Tanji,https://www.linkedin.com/in/anna-tanji-b680b4104,Davide Consiglio,https://www.linkedin.com/in/davideconsiglio,2019-02-01 20:28:42 UTC,Third Bridge Consultation | Predictive Analytics,"Hi Davide,  I hope you're doing well. I wanted to follow up and see if you had a chance to read over my previous message. My client is hoping to learn more about predictive analytics and I thought you'd be a great fit to consult on the topic. Do you have 5-10 minutes today to touch base over the phone and go over the details?  Best,  Anna   Anna Tanji 646-979-6265 To review Third Bridge's Privacy Policy, visit www.thirdbridge.com/en/privacy-policy",ARCHIVE
2-Njk0YmQ0MWEtYjJkMy01MjVhLWEyZGEtNjQxOGQzYTQzMzFhXzAxMw==,,Anna Tanji,https://www.linkedin.com/in/anna-tanji-b680b4104,Davide Consiglio,https://www.linkedin.com/in/davideconsiglio,2019-01-30 22:16:00 UTC,Third Bridge Consultation | Predictive Analytics,"Hi Davide,  I hope this message finds you well. I am a Research Analyst at Third Bridge, a primary research firm based in New York. I am reaching out because I have a client who is looking to better understand the predictive analytics market. They are hoping to speak with folks that have experience selling predictive analytics projects to Fortune 500 companies in the last two years and understand current needs.    I came across your profile on LinkedIn and I think you would be a great person to speak to this topic. This would only be 45-60 minutes on the phone with my client and you would be compensated for your time.    Do you have 10 minutes to discuss further on the phone today?   Best,  Anna   Anna Tanji 646-979-6265 To review Third Bridge's Privacy Policy, visit www.thirdbridge.com/en/privacy-policy",ARCHIVE
2-Mzg5ZjQ4NTQtMDk5Ny01MDZhLWI3MzItOTBmMmJlNjQ5NDhlXzAwMA==,,"Roberto Caporicci, MBA",https://www.linkedin.com/in/rcaporicci,Davide Consiglio,https://www.linkedin.com/in/davideconsiglio,2019-02-01 07:18:40 UTC,,Va bene. Di solito mi muovo in scooter quindi anche io credo di non arrivare presto! A dopo ,ARCHIVE
